title,company,url,description
"DevOps Engineer, Applied Machine Learning Engine - 2025 Start",BYTEDANCE PTE. LTD.,https://www.mycareersfuture.gov.sg/job/information-technology/devops-engineer-applied-machine-learning-engine-2025-start-bytedance-a9d05d82f366e963d1a64cf15782a092?source=MCF&event=Search,"Roles & Responsibilities
ByteDance will be prioritizing applicants who have a current right to work in Singapore, and do not require ByteDance's sponsorship of a visa.

Founded in 2012, ByteDance's mission is to inspire creativity and enrich life. With a suite of more than a dozen products, including TikTok and Helo as well as platforms specific to the China market, including Toutiao, Douyin, and Xigua, ByteDance has made it easier and more fun for people to connect with, consume, and create content.

Why Join Us
Creation is the core of ByteDance's purpose. Our products are built to help imaginations thrive. This is doubly true of the teams that make our innovations possible.
Together, we inspire creativity and enrich life - a mission we aim towards achieving every day.
To us, every challenge, no matter how ambiguous, is an opportunity; to learn, to innovate, and to grow as one team. Status quo? Never. Courage? Always.
At ByteDance, we create together and grow together. That's how we drive impact - for ourselves, our company, and the users we serve.
Join us.

About the Team
The Applied Machine Learning (AML) team combines system engineering and the art of machine learning to develop and run massively distributed recommendation system around the world.

On the team, you'll have the opportunity to sharpen your expertise in coding, performance analysis and large system operation, and get heavily involved in the process of hardware/capacity decision-making.

DevOps ensures that the very centric machine learning services at TikTok have the highest level of availability, as well as creating highly automated systems and pipelines.

We are looking for talented individuals to join us in 2025. As a graduate, you will get unparalleled opportunities for you to kickstart your career, pursue bold ideas and explore limitless growth opportunities. Co-create a future driven by your inspiration with ByteDance.

Candidates can apply to a maximum of two positions and will be considered for jobs in the order you apply. The application limit is applicable to ByteDance and its affiliates' jobs globally. Applications will be reviewed on a rolling basis - we encourage you to apply early.

Responsibilities
- Research, design, and develop computer and network software or specialised utility programs.
- Analyse user needs and develop software solutions, applying principles and techniques of computer science, engineering, and mathematical analysis.
- Update software, enhances existing software capabilities, and develops and direct software testing and validation procedures.
- Work with computer hardware engineers to integrate hardware and software systems and develop specifications and performance requirements.
- Research, design, and develop computer and network software or specialised utility programs.
- Analyse user needs and develop software solutions, applying principles and techniques of computer science, engineering, and mathematical analysis.
- Update software, enhances existing software capabilities, and develops and direct software testing and validation procedures.
- Work with computer hardware engineers to integrate hardware and software systems and develop specifications and performance requirements.
Qualifications
Minimum Qualifications
- Final year or recent graduate with a background in Software Development, Computer Science, Computer Engineering, or a related technical discipline
- Experience programming in at least one of the following languages: Python or C/C++
- Expertise in DevOps technologies like Ansible, Terraform, Salt, Bash Scripting, etc.
- Experience in building solutions with AWS, Google, Azures, AliCloud or other cloud services.
- Familiar with Unix/Linux operating systems.

Preferred Qualifications
- Ability to thrive in a fast-paced environment.
- Strong understanding of code optimizing and routine tasks automation.
- Proficiency in at least one machine learning framework: TensorFlow, PyTorch, MXNet or PaddlePaddle.
- Solid background of algorithms and data structures.

ByteDance is committed to creating an inclusive space where employees are valued for their skills, experiences, and unique perspectives. Our platform connects people from across the globe and so does our workplace. At ByteDance, our mission is to inspire creativity and enrich life. To achieve that goal, we are committed to celebrating our diverse voices and to creating an environment that reflects the many communities we reach. We are passionate about this and hope you are too.

By submitting an application for this role, you accept and agree to our global applicant privacy policy, which may be accessed here: https://jobs.bytedance.com/en/legal/privacy.

If you have any questions, please reach out to us at apac-earlycareers@bytedance.com"
Test Engineer,LMA RECRUITMENT SINGAPORE PTE. LTD.,https://www.mycareersfuture.gov.sg/job/accounting/test-engineer-lma-recruitment-singapore-adb814404dbcc019e696d3b45d976114?source=MCF&event=Search,"Roles & Responsibilities
About the Company:
Our client is an investment management firm headquartered in Singapore focused on investments throughout Asia.

About the Role:
The Test Engineer will design, develop and maintain test artifacts. Additionally, conduct, participate and facilitate User Acceptance Testing and any other testing that may be needed to meet the Project Objectives

Key Responsibilities:
Maintain and adopt best practices and lifecycles for process workflows
Collaborate with business users and business analysts to refine and understand both functional and non-functional requirements during SIT & UAT stages.
Where needed, develop automated GUI/API/DB/ETL test scripts to validate functional, technical and performance requirements
Collaborate with Developers/DevOps Engineers on code management, peer review, etc., where needed
Ensure quality at different phases of SDLC by adhering to processes and strategies defined by Eastspring Investments
Execute manual / automated/exploratory tests and provide QA sign-off to business users.
Maintain test process, design and execution artifacts in the test management system, complying with the audit regulations
Prepare testing traceability reports and other testing metrics

Requirements:
Recognized degree or higher in Computer Science or related Engineering fields.
At least 5+ years of working experience in Testing of software applications
Knowledge in Java programming will be advantageous
Would be advantageous to have knowledge and experience of comparing outputs, identifying differences and be able to explain differences. Eg: get files containing position and transaction information from 2 sources and run comparisons, load the files in the target application and validate the output.
Experience of relational databases and comfortable with testing SQL jobs and stored procedures with awareness of data security
Working experience with test automation tools
Good understanding of automation testing frameworks.
Working experience with test management tools such as Jira with Xray / Zephyr
Working knowledge of tools such as bitbucket, Jenkins, confluence and familiar with Git branching model
Good to have basic programming knowledge in Python.
Good to have basic knowledge in performance testing using any of the tools including JMeter, Gatling
Good to have knowledge of Azure cloud platform.
Good to have working experience in investment Bank or Asset Management industry and knowledge of Equity, Fixed Income, FX and Derivatives products.
Company Reg No.: 201131609D | License No.: 24S2411 | Reg No: R1110891 | SB"
Cloud Platform Engineer (AWS / DevOps),ALLEGIS GROUP SINGAPORE PRIVATE LIMITED,https://www.mycareersfuture.gov.sg/job/banking-finance/cloud-platform-engineer-allegis-group-singapore-9b7b4242889a577e7394db16ff2fadaa?source=MCF&event=Search,"Roles & Responsibilities
Location: Singapore (Hybrid – 4 days in office)
TEKsystems is a leading provider of technology consulting, committed to delivering innovative solutions and exceptional service to our clients. We’re hiring a Cloud Platform Engineer to join a high-performing tech team at a leading institutional investment firm.
🌐 About the Role
You'll help build and scale a secure, cloud-native developer platform used by hundreds of backend engineers. This is part of a multi-year cloud transformation initiative designed to enhance developer efficiency and internal platform reliability.
If you're an ex-software engineer who transitioned into DevOps or platform engineering — and you’re passionate about solving developer pain points at scale — this role is for you!
🛠 What You’ll Do
Build and support an internal cloud development platform as part of a cross-functional engineering team
Collaborate with backend developers to understand workflows and improve developer experience
Deploy and manage infrastructure on AWS using tools like Terraform, Docker, Kubernetes (EKS)
Develop automation pipelines and CI/CD workflows using GitHub Actions, Jenkins, or similar tools
Integrate monitoring and logging tools like CloudWatch, Datadog, Splunk for observability
Maintain system performance, troubleshoot issues, and support platform scaling
Work closely with engineering teams across departments to enable smooth cloud migration and adoption
✅ What We’re Looking For
We’re looking for someone with a strong software development background who has transitioned into DevOps or platform engineering.
Must-Have Skills:
4–5 years of experience in software engineering (Java, JavaScript, Python, or .NET)
2+ years of hands-on experience with AWS (EKS, EC2, IAM, S3, VPC, etc.)
Proficiency in containerization tools: Docker, Kubernetes, Helm
Strong Linux administration and shell scripting skills
Experience with Infrastructure-as-Code (Terraform or CloudFormation)
Familiarity with CI/CD tools (e.g. GitHub Actions, GitLab CI, Jenkins)
Working knowledge of logging/monitoring tools like Datadog, Splunk, CloudWatch
Strong problem-solving skills and ability to work across teams
Nice-to-Haves:
Experience in cloud migration or internal developer platforms
Experience with artifact management tools (e.g., JFrog Artifactory)
Strong communication and documentation skills
🧠 Who Will Succeed in This Role?
This role is ideal for someone who:
Has transitioned from backend development into DevOps/platform engineering
Enjoys solving technical challenges that improve developer productivity
Can explain systems clearly and collaborate across departments
Brings a deep understanding of cloud infrastructure and developer workflows
🌟 Why Join?
Join a tech-driven, well-funded institution on a multi-year cloud transformation
Be part of a team where engineers have the freedom to innovate and improve developer platforms
Work on enterprise-scale systems with the latest cloud-native technologies.
We regret to inform that only shortlisted candidates will be notified.

EA registration number : Garey Gan Chia Wen, R24124837

Allegis Group Singapore Pte Ltd, Company Reg No. 200909448N, EA License No. 10C4544"
Cloud DevOps Engineer,RAPSYS TECHNOLOGIES PTE. LTD.,https://www.mycareersfuture.gov.sg/job/information-technology/cloud-devops-engineer-rapsys-technologies-1ef831810f099aef7a417e2b79c66f31?source=MCF&event=Search,"Roles & Responsibilities
Role Overview:
A Cloud DevOps Engineer with strong experience in AWS, Terraform, and CI/CD pipelines. The ideal candidate will work on cloud infrastructure automation, workflow orchestration, and deployment pipelines, ensuring efficient and secure cloud operations.
Key Responsibilities:
• Design, implement, and manage AWS cloud infrastructure using Terraform.
• Develop and maintain CI/CD pipelines for seamless deployment and automation.
• Author playbooks, scripts, and workflows for infrastructure and application orchestration.
• Ensure compliance and security standards, particularly in Government Commercial Cloud (GCC & GCC+), and SHIP-HAT tools.
• Utilize Jira and automated testing tools to track, manage, and improve deployment processes.
• Collaborate with development teams to enhance Cloud DevOps practices.
Requirements:
• Strong hands-on experience with AWS and Terraform.
• Solid understanding of CI/CD methodologies and best practices.
• Experience with workflow orchestration, scripting, and automation pipelines.
• Practical knowledge of Jira and automated testing frameworks.
• Experience working in SG Government cloud environments (GCC, GCC+ preferred) and familiarity with SHIP-HAT tools.
• Proven expertise in Cloud DevOps and modern infrastructure management.
Preferred Qualifications:
• Certifications in AWS, Terraform, or DevOps methodologies.
• Experience with security and compliance frameworks in regulated cloud environments."
DevOps Support,THALES SOLUTIONS ASIA PTE. LTD.,https://www.mycareersfuture.gov.sg/job/information-technology/devops-support-thales-solutions-asia-fcc90c808fa1b13b687c989bbc747d6d?source=MCF&event=SuggestedJob,"Roles & Responsibilities
ROLE DESCRIPTION SUMMARY

Thales is seeking suitable candidate for the position of DevOps Support.
You will be maintaining and troubleshooting the hardware/software infrastructure and systems for a mission-critical Seamless Identity Management Platform for Experience (SIMPLE) system that Thales Solutions Asia (TSA) have designed for Singapore Changi Airport.
We are super excited if you have prior software development experience before you adopted DevOps as this experience would allow you to quickly identify the needs of any development team and bridge them effectively.
You will be part of a team of dedicated engineers that demonstrate superior technical competency in ensuring system availability, performance and security.

KEY ACTIVITIES AND RESPONSIBILITIES

As a DevOps Support, you are accountable for:

· Service Support. To carry out Corrective Maintenance (CM) as a result of failure of the hardware and software related to SIMPLE. To restore the system to its operational condition. To monitor and maintain the records of the overall system operational availability and reliability, including Mean Time Between Failure (MTBF), Mean Time to Repair (MTTR), system downtime duration and the types of hardware defects as well as all related software versions, patches.
· Field Testing and SW Troubleshooting. To carry out software testing and troubleshooting on the system whenever there is a new software bug fixes. To ensure the correct configuration of the system is loaded for software / system testing and before the system is used for production. Also to isolate the SW issues/bugs and identify the module/s that is associated and escalate to level 3.
· Spares Services. To manage the spares provisioning, support and test equipment and other tools that are stored at Authority site. To undertake store keeping functions in respect of receipt, issue and disposal. To carry out serviceability check on the spares and to ensure prompt and appropriate action is taken to rectify any fault on the spares. To monitor the end-of-life and end-of-support status of the spares and installed hardware.
· Preventive Maintenance (PM). To carry out PM on the hardware to retain the system in the specified operational condition in accordance to the planned maintenance schedule. In carrying out the PM, to follow the approved PM checklists to perform calibration, servicing and verification of system configurations. To submit the PM report after each PM.
· Calibration Services. To liaise with vendor to perform calibration services on the test equipment that are used for the preventive maintenance.

KEY KNOWLEDGE AND EXPERIENCE

To be successful in your role, you will have demonstrated and/or acquired the following knowledge and experience:

· Minimum of 3 years software experience where you spent at least 2 years working in DevOps.
· Working knowledge of IaC stack e.g. Ansible, Chef, Terraform etc
· Working knowledge of DVC tools like Git in a cloud native environment like GitLab
· Working knowledge of one or more system-level programming languages like BASH, ZSH,
· Python, Ruby, Go, Containers (ie Kubernates)
· Working knowledge of operating & maintaining Linux OSes (e.g. RedHat, Ubuntu, Slackware)
· Working knowledge of deploying SQL & No-SQL databases in production e.g PostgreSQL, MySQL, MongoDB, Cassandra, Hive
· Has a continuous learning mindset and learning of new paradigms, techniques & practices in build-test-release cycles and software automation
· Able to cope in a highly pressured fast-paced environment
· Open, strong communicator who communicates effectively across teams, locations and cultures, in-person and virtually
· Prior working experience in any Server / Network / Uninterruptible Power System / Security products such as Firewall, PIM and PAM and Server Virtualization will be an added advantage
· Customer orientated with high level of service attitude
· Good listening and analytical skills
· Hardworking, outgoing and enthusiastic
· Positive working attitude
· Team player, and also able to work independently and with little supervision
· Able to thrive in a dynamic environment
· Able to understand the system and architecture diagrams
· Able to understand the user operation environment
· Willingness to pick up new technologies
· Perform other job responsibilities as and when assigned

Education
Diploma / Bachelor’s Degree in IT/Engineering discipline

Experience
Minimally 1-2 years of experience in supporting network, security, server and UPS
Minimally 2 years of experience working in DevOps
Well-versed in IT Service Management (ITSM) standards, processes, guidelines and best practices will be an added advantage"
"Cloud DevOps Engineer (AWS, Terraform, and CI / CD)",ASTEK SINGAPORE INNOVATION TECHNOLOGY PTE. LTD.,https://www.mycareersfuture.gov.sg/job/information-technology/cloud-devops-engineer-astek-singapore-innovation-technology-e56ec2300a5710cc9853dcf68edb0953?source=MCF&event=Search,"Roles & Responsibilities

ASTEK has been providing IT and Engineering solutions for some of the world’s largest industrial and services groups for more than 35 years with 10,000 passionate experts in 22 countries throughout Europe, APAC, Middle East and the Americas

Currently, we are looking for Cloud DevOps Engineer with strong experience in AWS, Terraform, and CI/CD pipelines. The ideal candidate will work on cloud infrastructure automation, workflow orchestration, and deployment pipelines, ensuring efficient and secure cloud operations.

Responsibilities and requirements:
Bachelpr degree with experience in design, implement, and manage AWS cloud infrastructure using Terraform
Develop and maintain CI/CD pipelines for seamless deployment and automation
Author playbooks, scripts, and workflows for infrastructure and application orchestration
Utilize Jira and automated testing tools to track, manage, and improve deployment processes
Collaborate with development teams to enhance Cloud DevOps practices
Strong hands-on experience with AWS and Terraform
Solid understanding of CI/CD methodologies and best practices
Experience with workflow orchestration, scripting, and automation pipelines
Practical knowledge of Jira and automated testing frameworks
Proven expertise in Cloud DevOps and modern infrastructure management"
"DevOps Engineer[Central / Cloud / Container environments / AWS, GCP, and Linux / UNIX maintenance / Ansible, Terraform, Prometheus, Grafana / Python, Golang / large-scale containerized systems or automation tools]",LINKEDCORP HR CONSULTANCY PTE. LTD.,https://www.mycareersfuture.gov.sg/job/engineering/devops-engineercentral-cloud-container-environments-aws-gcp-linux-unix-maintenance-ansible-terraform-prometheus-grafana-python-golang-large-scale-containerized-systems-automation-tools-linkedcorp-hr-consultancy-df0cbc335f372008b5270526e5f8a53a?source=MCF&event=Search,"Roles & Responsibilities
Responsibilities:
Manage the deployment, configuration, operation, monitoring, and troubleshooting of applications on cloud servers and container platforms in production environments.
Collaborate with the development team to design highly available and scalable system architectures.
Contribute to the design and development of maintenance-related platforms.
Perform daily maintenance and optimization of platform systems.
Participate in designing and improving operational processes for system efficiency.
Requirements:
Bachelor’s degree in a computer-related field with 2+ years of experience.
Hands-on experience with cloud services (e.g., AWS, GCP).
Proficient in Linux/UNIX maintenance and configuring common services (e.g., load balancing, DNS, CDN, WAF).
Strong troubleshooting and problem-solving skills.
Familiar with configuration management tools like Ansible, SaltStack, Terraform, etc.
Proficient in scripting/development (e.g., Python, Golang).
Experience with large-scale containerized environments is a plus.
Knowledge of monitoring tools like Prometheus, Grafana, ELK, etc.
Bonus: Experience in developing monitoring systems, automation tools, or maintenance platforms.
Proactive, team-oriented, with strong communication and learning abilities."
AI Software Engineer (Manager) - SPVL,SCIENTEC CONSULTING PTE. LTD.,https://www.mycareersfuture.gov.sg/job/information-technology/ai-software-engineer-spvl-scientec-consulting-bfd5661c8cfe0afb80e7037fb0c15fc1?source=MCF&event=Search,"Roles & Responsibilities
We are looking for AI Software Engineer (Manager) to join a leading AI innovation government agency!
Exciting opportunity to work with a large team of AI professionals
Great exposure to government AI products, AI technologies and cloud (GCC)
Positive working environment with hybrid work arrangement
Attractive salary package + employment benefits

The team is responsible for the end-to-end SDLC, including fine-tuning and optimizing AI products, particularly LLM. Your main responsibilities will be overseeing the development of AI products and solutions, includes managing software, QA, and AI engineering teams. The role requires strong technical expertise, business acumen, the ability to engage with external partners, and the skill to explain technical solutions in simple terms to non-technical stakeholders.

What you will be working on:
Lead the software engineering, quality assurance and devsecops technical functions in product team(s)
Define engineering scope of work based on defined features and requirements and oversee the day-to-day development
Make technical decisions and advise the team on the software development approach to take, considering trade-offs between the approaches and mitigating known drawbacks
Integrate software engineering, quality assurance, devsecops, and mlops frameworks, guidelines and processes taking into account industry best practices, into software development activities
Define, implement and continuously improve software development processes within the team to ensure reliability, and maintainability of released software products
Collaborate with both internal and external stakeholders to define software features and implement software products that meet their business needs
Guide the engineering team to write production quality code and deliver products and solution to end users
Manage team’s resources and work performance and to match individual aspiration with stakeholders’ requirements
Foster a culture of learning, experimentation, and continuous improvement in the software engineering team
Keep abreast of new AI and Software engineering practices and technologies, and continuously improve S&S COE’s engineering internal workflow and practices

What we are looking for:
Min 6 years of relevant professional work experience relating to software engineering, quality assurance or system engineering
Min 3 years of experience in designing, developing, deploying, and monitoring machine learning and deep learning solutions using Docker, Kubernetes or Kubeflow
Min 3 years of experience working in Cloud environment (AWS or Azure), experience with Government Commercial Cloud (GCC) environment will be strongly preferred
Competent in Python programming language, and able to do Bash and PowerShell Scripting on Linux Operating system
A proven track record of people management (working with AI engineers, Software Engineers, QA Engineers or DevOps engineers) and being able to develop individuals’ careers and motivation to achieve team’s outcomes
Good to have experience in AI-related technologies, AI/ML, Data Science and Data Analytics

By submitting your resume, you consent to the collection, use, and disclosure of your personal information per ScienTec’s Privacy Policy (scientecconsulting.com/privacy-policy).

This authorizes us to:
Contact you about potential opportunities.
Delete personal data not required at this application stage.
To withdraw consent, email dpo@scientecconsulting.com.
All applications will be processed with strict confidence. Only shortlisted candidates will be contacted.

Liew Chien Hui (Vivian) - R2090138
ScienTec Consulting Pte Ltd - 11C5781"
