title,company,url,description
DevOps / Technical Support Engineer (Server & Storage),STAT SPACE (SGP) TECH PTE. LTD.,https://www.mycareersfuture.gov.sg/job/engineering/devops-technical-support-engineer-stat-space-tech-350005a7841b51bceaaaa97b51f0cd71?source=MCF&event=Search,"Roles & Responsibilities
Responsibilities:
Deploy, maintain, and troubleshoot server/storage systems for AI training clusters, ensuring infrastructure stability.
Develop monitoring and automation tools for hardware management platforms.
Optimize performance parameters of servers, networks, and storage systems.
Establish server configuration standards and develop maintenance/benchmarking tools.
Participate in 24/7 on-call rotation for incident response and user support.
Requirements:
Bachelor’s degree or above in Computer Science, Telecommunications, or related fields.
Expertise in server hardware (BIOS/RAID/firmware) and OS-level tuning.
Proficient in Python/Shell/Go for tooling development.
Hands-on experience with distributed storage systems (GPFS/Ceph/GlusterFS).
Prior experience in large-scale (1k+ nodes) training cluster deployment is preferred."
Software Developer (Snr DevOps Platform Engineer),GMP TECHNOLOGIES (S) PTE LTD,https://www.mycareersfuture.gov.sg/job/information-technology/software-developer-gmp-technologies-60c768345d809dc6752a0dc54fbc4c5e?source=MCF&event=Search,"Roles & Responsibilities
Main Responsibilities
Research, design, and develop computer software or specialised utility programs.- ok
Develop and maintain automation tools for infrastructure provisioning, configuration management, and deployment.
Collaborate with development teams to implement CI/CD pipelines and automate deployment processes.
Monitor and troubleshoot infrastructure and application performance issues.
Implement security best practices and ensure compliance with industry standards.
Stay up-to-date with the latest DevOps technologies and trends.
Contribute to the development and improvement of our DevOps culture and processes.
Qualifications and Profile
Technical
Good knowledge in UNIX platform and database management systems such as SQL, Oracle, Sybase and BigData.
Experience with automation frameworks and libraries.
Proficiency in scripting languages such as Python, Shell script andPowerShell.
Good exposure to DevOps tools & technologies like Gitlab, Ansible, Jenkins, Maven, Elastic Search, Grafana, Prometheus, Kibana, Control-M, KAFKA, Confluence, Jira, and MQ Series.
Experience with Docker/Kurbernetes
Knowledge of Cloud platforms and services
Functional
Experience in supporting capital market applications and trading systems, ideally within the dynamic landscape of Market Risk/Front Office operations with a commendable grasp of financial products (Treasury, FX, Credit, IRD, Bonds, RSF etc.)
Nice to Have
Experience in supporting banking applications and trading systems
Any Object-oriented language: Java, .Net
Domain-Driven design and Microservices: Springboot
Other Professional Skills and Mindset
Excellent communication and interpersonal skills to effectively collaborate with diverse teams.
Excellent problem-solving and analytical skills.
Ability to work under pressure.
Appetite to follow technology trend and participate to communities.
Eagerness to learn and adapt to new technologies.
Strong perseverance and diligence towards attaining goals and effective time management
Passion for sharing expertise and grow team members skills.
Autonomous, self-motivated and excellent team player
Experience & Education Requirements
Candidates should have 8+ years experience in relevant activities.
Master or Bachelors degree in Computer Science/ Information Technology/ Programming & Systems Analysis/ Science (Computer Studies) faculties.
GMP Recruitment Services (S) Pte Ltd | EA Licence: 09C3051 | VO UYEN AI LINH | Registration No: R22109232

This is in partnership with the Employment and Employability Institute Pte Ltd (“e2i”).
e2i is the empowering network for workers and employers seeking employment and employability solutions. e2i serves as a bridge between workers and employers, connecting with workers to offer job security through job-matching, career guidance and skills upgrading services, and partnering employers to address their manpower needs through recruitment, training, and job redesign solutions. e2i is a tripartite initiative of the National Trades Union Congress set up to support nation-wide manpower and skills upgrading initiatives.
By applying for this role, you consent to GMP Technologies (S) Pte Ltd’s PDPA and e2i’s PDPA."
Cloud Platform Engineer (AWS / DevOps),ALLEGIS GROUP SINGAPORE PRIVATE LIMITED,https://www.mycareersfuture.gov.sg/job/banking-finance/cloud-platform-engineer-allegis-group-singapore-d6ae1d86d987c393f36806bf72cf20c4?source=MCF&event=Search,"Roles & Responsibilities
Location: Singapore (Hybrid – 4 days in office)
TEKsystems is a leading provider of technology consulting, committed to delivering innovative solutions and exceptional service to our clients. We’re hiring a Cloud Platform Engineer to join a high-performing tech team at a leading institutional investment firm.
🌐 About the Role
You'll help build and scale a secure, cloud-native developer platform used by hundreds of backend engineers. This is part of a multi-year cloud transformation initiative designed to enhance developer efficiency and internal platform reliability.
If you're an ex-software engineer who transitioned into DevOps or platform engineering — and you’re passionate about solving developer pain points at scale — this role is for you!
🛠 What You’ll Do
Build and support an internal cloud development platform as part of a cross-functional engineering team
Collaborate with backend developers to understand workflows and improve developer experience
Deploy and manage infrastructure on AWS using tools like Terraform, Docker, Kubernetes (EKS)
Develop automation pipelines and CI/CD workflows using GitHub Actions, Jenkins, or similar tools
Integrate monitoring and logging tools like CloudWatch, Datadog, Splunk for observability
Maintain system performance, troubleshoot issues, and support platform scaling
Work closely with engineering teams across departments to enable smooth cloud migration and adoption
✅ What We’re Looking For
We’re looking for someone with a strong software development background who has transitioned into DevOps or platform engineering.
Must-Have Skills:
4–5 years of experience in software engineering (Java, JavaScript, Python, or .NET)
2+ years of hands-on experience with AWS (EKS, EC2, IAM, S3, VPC, etc.)
Proficiency in containerization tools: Docker, Kubernetes, Helm
Strong Linux administration and shell scripting skills
Experience with Infrastructure-as-Code (Terraform or CloudFormation)
Familiarity with CI/CD tools (e.g. GitHub Actions, GitLab CI, Jenkins)
Working knowledge of logging/monitoring tools like Datadog, Splunk, CloudWatch
Strong problem-solving skills and ability to work across teams
Nice-to-Haves:
Experience in cloud migration or internal developer platforms
Experience with artifact management tools (e.g., JFrog Artifactory)
Strong communication and documentation skills
🧠 Who Will Succeed in This Role?
This role is ideal for someone who:
Has transitioned from backend development into DevOps/platform engineering
Enjoys solving technical challenges that improve developer productivity
Can explain systems clearly and collaborate across departments
Brings a deep understanding of cloud infrastructure and developer workflows
🌟 Why Join?
Join a tech-driven, well-funded institution on a multi-year cloud transformation
Be part of a team where engineers have the freedom to innovate and improve developer platforms
Work on enterprise-scale systems with the latest cloud-native technologies.
We regret to inform that only shortlisted candidates will be notified.

EA registration number : Garey Gan Chia Wen, R24124837

Allegis Group Singapore Pte Ltd, Company Reg No. 200909448N, EA License No. 10C4544"
Senior DevOps Engineer / SRE Engineer,GOSSTECH PTE. LTD.,https://www.mycareersfuture.gov.sg/job/information-technology/senior-devops-engineer-sre-engineer-gosstech-0160ae573f6b2cb12c80ffacd9f4bd91?source=MCF&event=Search,"Roles & Responsibilities
Job Responsibilities:
Responsible for the management of Site Reliability Engineering, have hands-on knowledge on manage & troubleshot server, network and applications;
Responsible for the deployment and daily monitoring of the company's business systems to ensure the normal operation and emergency response;
Provide in-depth understanding of the operation and maintenance architecture, good at architecture design, performance optimization, platform security; Responsible for the improvement of the operation and maintenance team skills, to ensure the professional level of the operation and maintenance team.
Establish and improve standardized operation systems for DevOps team. Use a sound management strategies and security strategies to ensure the quality of operation and maintenance;
Job Requirements:
Familiar with automation deployment, proficient in how to build the most of popular monitoring system in the market. SVN/Git version control system and proficient in CICD configuration;
Hands-on knowledge in Nginx configuration, Load balancer (SLB) configuration. Familiar with Node.js running environment will be an advantage.
Skilled in managing Linux systems and security, with experience in operation and maintenance of large websites or web application platforms;
Understand common knowledge about the network, familiar with firewall, VPN, DHCP, DNS and other network technologies. Familiar with high availability/load balancing technology will be an advantage;
High sense of responsibility, strong ability to analyze and eliminate faults, good at learning at work, able to withstand work stress;
Understand the penetration test, have experience in safe operation and maintenance, and have working experience in Cloud platforms (AZURE, AWS or Google);
Working Environments: Hyper-Cloud, Cloudform/AWX, ELK, Zabbix, Jenkins/VSTS, GitLab etc. We build together, We learn together.
Candidate must possess at least Bachelor's Degree/Post Graduate Diploma/Professional Degree in Engineering (Computer/Telecommunication), Engineering (Electrical/Electronic), Computer Science/Information Technology or equivalent.
At least 3 years of working experience in the related field is required for senior position.
Preferably Senior Executive specialized in IT/Computer - Network/System/Database Admin or equivalent.
What we offer:
Proper training will provide to the senior position
Attractive rewards for long-term service staff
Energetic and friendly working environment (flexible working hours, quarterly events, staff birthday celebration and etc.)
Medical insurance"
DevOps Engineer (AWS / AZURE),SOURCEO PTE. LTD.,https://www.mycareersfuture.gov.sg/job/information-technology/devops-engineer-sourceo-5ffa4a57de5cc3409b9123d9e326ec26?source=MCF&event=Search,"Roles & Responsibilities
REQUIREMENETS:

Must have hands-on experience with a large cloud platform (e.g. AWS, Azure) and know related platforms like OpenShift or GovTech's GCC.
Certifications or knowledge of multi-cloud and cloud optimisation are a bonus.
Have a degree in computer science or a related field (bachelor's/master's).
Have 6+ years of professional experience in software development. With at least 4 years spent in DevOps roles, you gained expertise and are up to date on a wide spectrum of modern technologies and best practices.
You have in-depth knowledge of managing and running CI/CD platforms (e.g. GitLab, GitHub Actions). You can automate the setup of pipelines with custom runners and with quality & security in mind.
Have worked on deployment models ranging from on-premise VMs to cloud-native solutions, and container technology is second nature for you. Ideally, you can consult teams on migration strategies for application modernisation.
Toolset contains configuration management, infrastructure-as-code, and observability solutions (e.g. Terraform, Octopus Deploy, DataDog, Helm)."
Devops Engineer #IJW,RECRUIT EXPRESS PTE LTD,https://www.mycareersfuture.gov.sg/job/information-technology/devops-engineer-ijw-recruit-express-79280e41a9a580190f740d91cbcd3283?source=MCF&event=Search,"Roles & Responsibilities
Responsibilities
Apply cloud (AWS, Azure, GCP) computing skills to deploy upgrades and fixes.
Put in place continuous integration (CI) and continuous deployment (CD) processes and tools to deliver quality software based on user feedback.
Develop scripts to automate build, software release, application deployment and system and application management.
Collaborate with team members to improve the company’s engineering tools, systems and procedures, and data security.
Conduct automated system-level vulnerability security scan, harden system and application platform.
Liaise with software and hardware vendors to manage and resolve incidents and technical issues.
Liaise with 3rd party hosting providers to manage and resolve incidents and technical issues.
Prepare and maintain technical documentation.
Requirements
Bachelor’s in Computer Science, Information Technology, Software Engineering, or a related field.
Past track records in Solaris UNIX/Linux/Windows Systems Administration.
Expert in code deployment tools (GIT, Nexus, Ansible, and Chef).
Exhibit expertise in software development methodologies.
Strong knowledge in setting up DevOps tools.
Past track records in virtualisation/container technology and setting up continuous integration/continuous deployment processes and tools.
Knowledge in application development and setting up of middleware.
Knowledge in vulnerability assessment and remediation.
Knowledge in setting up and maintaining databases.


Interested applicants, please Email , and look for johnwong@recruitexpress.com.sg
John (Joax) Wong
Recruit Express Pte Ltd
EA License No. 99C4599
EA Personnel Registration Number: R23117179
We regret that only shortlisted candidates will be contacted."
DevOps Engineer (QA),KRIS INFOTECH PTE. LTD.,https://www.mycareersfuture.gov.sg/job/information-technology/devops-engineer-kris-infotech-f12cccbd2d5193be90f9adcc0278add7?source=MCF&event=SuggestedJob,"Roles & Responsibilities
Job Description:
Research, design, and develop computer software or specialised utility programs.
Develop and maintain automation tools for infrastructure provisioning, configuration management, and deployment and quality assurance.
Collaborate with development teams to implement CI/CD pipelines and automate deployment as well as test processes.
Work on the industrialization of test management.
Work on the management of OT DeKOT environments.
Work on the preparation/industrialization of the transition to Run mode of Orchestrade for Treasury.
Monitor and troubleshoot infrastructure and application performance issues.
Implement security best practices and ensure compliance with industry standards.
Contribute to the development and improvement of our DevOps culture and processes.
Design and develop comprehensive quality assurance strategies and frameworks.
Implement automated testing systems to ensure reusability and efficiency.
Design and implement comprehensive test plans and test cases based on requirements and design documentation. Develop automated test systems to ensure reusability and efficiency.
Promote and implement testing methodologies, aiming to identify and address defects early in the development lifecycle.
Provide technical support to other teams, assisting with problems encountered internally, such as system malfunctions. Propose solutions, suggest improvements, and contribute to data analysis.
Document all testing activities, including test results, discovered defects, and any relevant observations. Prepare detailed reports for management and the Delivery Team
Stay up-to-date with the latest DevOps technologies and trends.
This position will be an important pillar of Support Orchestrade for Treasury. Gradually, this position will perform application support for users (Front to BO).
Requirements:
Candidates should have minimum 5 years experience in relevant activities.
Technical
Good knowledge in UNIX platform and database management systems such as SQL, Oracle, Sybase.
Development in C# .net a must have
Experience with automation frameworks and libraries.
Proficiency in scripting languages such as Python, Shell script and PowerShell.
Good exposure to DevOps tools & technologies like Gitlab, Ansible, Jenkins, Maven, Elastic Search, Grafana, Prometheus, Kibana, Control-M, KAFKA, Confluence, Jira, and MQ Series and test automation tools like Selenium (and other test automation frameworks), cucumber etc.
Experience with Docker/Kurbernetes.
Knowledge of Cloud platforms and services.
.net and Azure devops.
Functional
Experience in supporting capital market applications and trading systems, ideally within the dynamic landscape of Treasury and Fixed Income Front Office operations with a commendable grasp of financial products (Treasury, FX, Credit, IRD, Bonds, RSF etc.)
Nice to Have
Experience in supporting banking applications and trading systems.
Domain-Driven design and Microservices: Springboot.
Other Professional Skills and Mindset
Excellent communication and interpersonal skills to effectively collaborate with diverse teams.
Excellent problem-solving and analytical skills.
Ability to work under pressure.
Appetite to follow technology trend and participate to communities.
Eagerness to learn and adapt to new technologies.
Strong perseverance and diligence towards attaining goals and effective time management
Passion for sharing expertise and grow team members’ skills.
Autonomous, self-motivated and excellent team player
Ability and flexibility to work with cross-geographical teams operating in different time zones."
"Senior Technical Support Engineer, SD-WAN",PALO ALTO NETWORKS (NETHERLANDS) B.V. (SINGAPORE BRANCH),https://www.mycareersfuture.gov.sg/job/information-technology/senior-technical-support-engineer-sd-wan-palo-alto-networks-bv-c3c6c1dd399ed6657a9e5f6c72934b14?source=MCF&event=Search,"Roles & Responsibilities
Our Mission
At Palo Alto Networks® everything starts and ends with our mission:
Being the cybersecurity partner of choice, protecting our digital way of life.
Our vision is a world where each day is safer and more secure than the one before. We are a company built on the foundation of challenging and disrupting the way things are done, and we’re looking for innovators who are as committed to shaping the future of cybersecurity as we are.
Our Approach to Work
We lead with flexibility and choice in all of our people programs. We have disrupted the traditional view that all employees have the same needs and wants. We offer personalization and offer our employees the opportunity to choose what works best for them as often as possible - from your wellbeing support to your growth and development, and beyond!
At Palo Alto Networks, we believe in the power of collaboration and value in-person interactions. This is why our employees generally work from the office three days per week, leaving two days for choice and flexibility to work where you feel most effective. This setup fosters casual conversations, problem-solving, and trusted relationships. While details may evolve, our goal is to create an environment where innovation thrives, with office-based teams coming together three days a week to collaborate and thrive, together!
Your Career
You will work firsthand with our valued customers to address their complex post-sales concerns where analysis of situations or data requires an in-depth evaluation of many factors. You’re a critical thinker in understanding the methods, techniques, and evaluation criteria for obtaining results. You’ll enjoy networking with key contacts outside your own area of expertise, with a strong capability of detailing difficult technical issues to both non-technical and technical professionals.
You will regularly participate in technical discussions with multi-functional teams, creating an environment of transparency that ultimately leads to better products, better working environments, and better cybersecurity. Your quick thinking and support to our clients provides the fast assistance they need to keep their environments secure – which means you’ll need to move quickly, thoughtfully, and provide technical assistance as needed (often, in high pressure situations).
Your Impact
Provide Technical Support to customers and partners
Provide configurations, troubleshooting and best practices to customers
Manage support cases to ensure issues are recorded, tracked, resolved, and follow-ups are completed in a timely manner
Provide fault isolation and root cause analysis for technical issues
Publish Technical Support Bulletins and other technical documentation in the Knowledge Base
Review of technical documentation for training materials, technical marketing collateral, manuals, troubleshooting guides, etc
Your Experience
Experience - 5+ years in support roles, working directly with large global customers and partners in addition to internal teams (such as DevOps, Engineering, QA, Product managers)
Working experience in configuring and troubleshooting SD-WAN technologies
Expertise with Remote Access VPN solutions, IPSEC, PKI & SSL, TCP/IP, Authentication Protocols (LDAP, RADIUS etc.)
Experience working with Firewall Central Management Systems
Experience working with multi-factor authentication security system (tokens, certificates, CAC cards, and similar)
Working knowledge of Security services (IDS/IPS, Firewalls etc.)
Strong ability to independently debug broad, complex, and unique networks with mixed media and protocols required
Excellent written and verbal communication skills are required
Virtualization experience (AWS, Azure, VMWare, OpenStack) is a plus
Experience with Windows and MAC OS is a plus (Debugging, Editing Registries, Plist etc.)
Working experience in Silverpeak, Huawei, Fortinet or any vendor related SD-WAN devices is a plus
Experience with Cisco, Checkpoint, Juniper (Netscreen), and Fortinet products a plus
Experience with designated customers is a plus
Candidate having CCIE/CCNA is a plus
The Team
Our technical support team is critical to our success and mission. As part of this team, you enable customer success by providing support to clients after they have purchased our products. Our dedication to our customers doesn’t stop once they sign – it evolves. As threats and technology change, we stay in step to accomplish our mission.
You’ll be involved in implementing new products, transitioning from old products to new, and will fix integrations and critical issues as they are raised – in fact, you’ll seek them out to ensure our clients are safely supported. We fix and identify technical problems, with a pointed focus of providing the best customer support in the industry.
Our Commitment
We’re trailblazers that dream big, take risks, and challenge cybersecurity’s status quo. It’s simple: we can’t accomplish our mission without diverse teams innovating, together.
We are committed to providing reasonable accommodations for all qualified individuals with a disability. If you require assistance or accommodation due to a disability or special need, please contact us at accommodations@paloaltonetworks.com.Palo Alto Networks is an equal opportunity employer. We celebrate diversity in our workplace, and all qualified applicants will receive consideration for employment without regard to age, ancestry, color, family or medical care leave, gender identity or expression, genetic information, marital status, medical condition, national origin, physical or mental disability, political affiliation, protected veteran status, race, religion, sex (including pregnancy), sexual orientation, or other legally protected characteristics.
All your information will be kept confidential according to EEO guidelines.
Req ID: 3126743"
Middleware Engineer with DevOps,APAR TECHNOLOGIES PTE. LTD.,https://www.mycareersfuture.gov.sg/job/information-technology/middleware-engineer-devops-apar-technologies-eeb290f9e5a548f58e7fefd48410f71e?source=MCF&event=Search,"Roles & Responsibilities
Job Description:
We are seeking a skilled Middleware Engineer with DevOps responsibilities to design, implement, and maintain middleware solutions while applying DevOps principles to ensure automation, CI/CD, and system reliability.
Key Responsibilities:
Design and implement robust middleware solutions using industry-standard technologies.
Apply DevOps practices to support automation and continuous integration/deployment pipelines.
Maintain and monitor middleware systems to ensure high availability and performance.
Develop and maintain scripts for automation and configuration management.
Collaborate with cross-functional teams to ensure system reliability and scalability.
Requirements:
Minimum 6 years of experience in Middleware Engineering with DevOps exposure.
Hands-on expertise in Terraform, Ansible, GitHub, and middleware components (Application Server).
Strong understanding of DevOps principles, CI/CD processes, and infrastructure automation.
Proficient in scripting for system automation and orchestration.
Experience working with cloud platforms and modern deployment strategies.
EA Number: 11C4879"
