title,company,url,description
DevOps Engineer (QA),LUXOFT INFORMATION TECHNOLOGY (SINGAPORE) PTE. LTD.,https://www.mycareersfuture.gov.sg/job/banking-finance/devops-engineer-luxoft-information-technology-e11a852381e36ff5a1e323f99464ee11?source=MCF&event=Search,"Roles & Responsibilities
Project Description:Our client is the corporate and investment banking arm of The Group, world's 12th largest bank by total assets.
We work daily with international branches located in 30 markets by:
- Envisioning and preparing the Bank's futures information systems
- Partnering and supporting core banking flagships and transverse areas in their large scale development projects.
- Providing premium In-house Banking applications,
This unique positioning empowers us to bring our core banking business a sustainable competitive advantage on the market.
We seek innovative and agile people sharing our mindset to support ambitious and forthcoming technological challenges.

We are seeking a talented Engineer to join our dynamic Capital Markets IT Department!

You will be responsible for designing, implementing, and maintaining our infrastructure and automation tools. You will work closely with development teams to ensure smooth deployment and operation of our applications. You will be a key contributor to our continuous improvement efforts, ensuring our environments are always reliable, secure, and efficient.

You will be responsible for design, develop and implement comprehensive test strategy and test cases based on requirements and design documentation. Develop automated test systems to ensure reusability and efficiency and promote usage of testing methodologies aiming to identify and address defects early in the development lifecycle.

Capital Markets IT involves technology solutions and systems used in financial markets for trading, investment, and related activities. This includes electronic trading platforms, risk management systems, market risk, counterparty risk, algorithmic trading, data analytics, and regulatory measures. The use of advanced technologies like API's, artificial intelligence and cloud solutions are also becoming increasingly prevalent in capital markets to enhance efficiency and decision-making processes.

We are starting the decommissioning of our Kondor Plus trading platform for our Treasury business to transfer this activity to our main front office target platform (Orchestrade or OT). Orchestrade is already implemented for other asset classes.

The DeKOT project (decommissioning of Kondor+ to migrate into Orchestrade) will migrate our worldwide cross asset treasury platform (all products) booked in several instances of Kondor Plus. We are creating a team in Singapore to take in charge some part of the project (e.g. Inbound and outbound flows of the platform for various systems or modules, OT API and format such as Json, Protobuf, CIBML...). Performance and latency of those interfaces will be key for the success of the project.

With strong interactions with our Paris Head office team, the developer would put in place the first foundations of a development team based in Asia in Singapore. The developer joins a future team of Front Office developers that will grow and will be key in the future for our technology hub in Singapore. The team will be fully allocated to this project and will be part of a multi sites project team
Responsibilities:
• Research, design, and develop computer software or specialised utility programs.
• Develop and maintain automation tools for infrastructure provisioning, configuration management, and deployment and quality assurance.
• Collaborate with development teams to implement CI/CD pipelines and automate deployment as well as test processes.
• Work on the industrialization of test management.
• Work on the management of OT DeKOT environments.
• Work on the preparation/industrialization of the transition to Run mode of Orchestrade for Treasury.
• Monitor and troubleshoot infrastructure and application performance issues.
• Implement security best practices and ensure compliance with industry standards.
• Contribute to the development and improvement of our DevOps culture and processes.
• Design and develop comprehensive quality assurance strategies and frameworks.
• Implement automated testing systems to ensure reusability and efficiency.
• Design and implement comprehensive test plans and test cases based on requirements and design documentation. Develop automated test systems to ensure reusability and efficiency.
• Promote and implement testing methodologies, aiming to identify and address defects early in the development lifecycle.
• Provide technical support to other teams, assisting with problems encountered internally, such as system malfunctions. Propose solutions, suggest improvements, and contribute to data analysis.
• Document all testing activities, including test results, discovered defects, and any relevant observations. Prepare detailed reports for management and the Delivery Team
• Stay up-to-date with the latest DevOps technologies and trends.
• This position will be an important pillar of Support Orchestrade for Treasury. Gradually, this position will perform application support for users (Front to Back Office).

Mandatory Skills Description:
• 5+ years of relevant working experience
• Experience in supporting banking applications/trading systems
• Good exposure to test automation tools like Selenium (and other test automation frameworks), cucumber etc.
• Good knowledge in UNIX platform and database management systems such as SQL, Oracle, Sybase.
• Experience with automation frameworks and libraries.
• Proficiency in scripting languages such as Python, Shell script and PowerShell.
• Good exposure to DevOps tools & technologies like Gitlab, Ansible, Jenkins, Maven, Elastic Search, Grafana, Prometheus, Kibana, Control-M, KAFKA, Confluence, Jira, and MQ Series
• Experience with Docker/Kurbernetes
• Knowledge of Cloud platforms and services
• .net and Azure devops
• Excellent communication and interpersonal skills to effectively collaborate with diverse teams.
• Excellent problem-solving and analytical skills.
• Ability to work under pressure.
• Appetite to follow technology trend and participate to communities.
• Eagerness to learn and adapt to new technologies.
• Strong perseverance and diligence towards attaining goals and effective time management
• Passion for sharing expertise and grow team members' skills.
• Autonomous, self-motivated and excellent team player
• Ability and flexibility to work with cross-geographical teams operating in different time zones.

Nice-to-Have Skills Description:
• Experience in supporting capital market applications and trading systems, ideally within the dynamic landscape of Front Office operations with a commendable grasp of financial products (Treasury, FX, Credit, IRD, Bonds, RSF etc.)
• Domain-Driven design and Microservices: Springboot
• Development in C# .net"
Senior Software Engineer - Embedded / DevOps,ANOTECH ENERGY SINGAPORE PTE. LTD.,https://www.mycareersfuture.gov.sg/job/consulting/senior-software-engineer-embedded-devops-anotech-energy-singapore-9c28ed72f56b2e39db2e15f7c540a6f9?source=MCF&event=Search,"Roles & Responsibilities
As a Senior Software Engineer, you will be responsible for design, implementation, validation and deployment of Embedded Products for major OEM customers.

Responsibilities
· Develop, validate and deploy new software components (for example advance software security mechanism and next generation IoT connectivity protocols) for embedded operating systems targeted for mobile and IoT devices, in applications such as mobile payment, digital identity and IoT connectivity
· Participate to the development of next generation operating systems for future devices
· Being in agile development environment to work closely within team and multiple teams around the world to build great products exceeding customer expectations
· Contribute to continuous product and development methodology improvement

Requirements
· Degree in Electrical/Electronics/Computer/Software Engineering, or related fields.
· Minimum 5 years of practical experience in software development as developer/validator
· Proficient in C/Java/VB.NET programming languages
· Knowledge and experience in DevOps system is required
· Knowledge and experience in embedded technologies/ecosystem is required
· Knowledge in smartcard, embedded software security or Javacard is a plus
· Team player with good communications and collaborative skills"
Senior DevOps Engineer (Cloud Infrastructure),TOKENINSIGHT SG PTE. LTD.,https://www.mycareersfuture.gov.sg/job/engineering/senior-devops-engineer-tokeninsight-sg-1c60eee87fbb322a0af495dcd05b6e6c?source=MCF&event=Search,"Roles & Responsibilities
Responsibilities
Manage cloud resources using Infrastructure as Code (IaC) tools (e.g., Terraform) to automate deployment, scaling, and lifecycle management.
Oversee full cloud resource lifecycle management, including provisioning, monitoring, security, compliance, and decommissioning.
Design and implement automated resource management solutions to enhance efficiency and cost optimization.
Deploy, maintain, and iterate on CMDB (Configuration Management Database) systems, ensuring data accuracy and real-time updates.
Integrate CMDB with other IT operations and automation systems to enable dynamic infrastructure management.
Standardize server provisioning processes to ensure a consistent cloud infrastructure environment.
Define and enforce operational policies and workflows to ensure compliance, security, and auditability.
Monitor and analyze cloud resource usage, implement cost-control measures, and develop capacity planning strategies.
Provide technical support for business systems, ensuring high availability, stability, and security.
Participate in security audits and compliance assessments, implementing security-hardening strategies.
Requirements
Bachelor's degree in Computer Science or related fields, with 5+ years of experience in cloud infrastructure operations.
Deep familiarity with AWS, Azure, Alibaba Cloud, or other major cloud providers.
Strong programming skills in Golang or Python, with experience in debugging and system design.
Knowledge of Linux system internals, networking, and distributed systems architecture.
Expertise in Terraform and Infrastructure as Code (IaC) principles.
Strong problem-solving abilities, capable of managing large-scale cloud environments.
Preferred Qualifications
Experience in building self-hosted CMDB platforms or managing multi-cloud environments.
In-depth knowledge of AWS IAM and enterprise-grade access control frameworks.
Understanding of Linux kernel subsystems (e.g., schedulers, networking, file systems) or containerization internals (e.g., cgroups, namespaces)."
Cloud Native DevOps Engineer (Kubernetes),TOKENINSIGHT SG PTE. LTD.,https://www.mycareersfuture.gov.sg/job/engineering/cloud-native-devops-engineer-tokeninsight-sg-210a442817493664118b738c419ce4e9?source=MCF&event=Search,"Roles & Responsibilities
Responsibilities
Manage and maintain the company-wide container platform, ensuring version upgrades, capacity planning, and system stability.
Optimize cluster scheduling and parameter tuning to enhance resource utilization and performance.
Quickly diagnose and resolve issues within Kubernetes clusters to ensure high availability.
Design and develop core features of the container platform, improving scalability and usability.
Enhance automation by integrating and optimizing container ecosystem tools.
Lead the migration of traditional services to a containerized architecture, ensuring seamless implementation.
Oversee the transition of self-hosted clusters to cloud-managed Kubernetes (e.g., AWS EKS) while ensuring system stability.
Provide technical support and best practices to internal teams, solving complex technical issues related to containerization.
Document technical processes and conduct training to strengthen the team's expertise in container technologies.
Requirements
Bachelor's degree in Computer Science or related fields, with 5+ years of experience in DevOps or cloud-native technologies, including at least 2 years focused on containerization.
Strong foundation in Linux OS, networking (L4/L7), and distributed systems architecture.
Proficiency in Golang and Java, with knowledge of data structures, algorithms, and software design patterns.
In-depth expertise in Kubernetes, with experience in at least one core subsystem (e.g., scheduler, runtime, networking).
Hands-on experience with container networking solutions (e.g., Calico, Cilium) and service mesh frameworks (e.g., Istio).
Self-driven, results-oriented, and capable of managing projects independently.
Preferred Qualifications
Experience with container security (e.g., image scanning, runtime protection).
Hands-on experience in migrating workloads to cloud-based Kubernetes solutions.
Experience with big data frameworks (e.g., Spark, Flink) running on Kubernetes."
Blockchain Infrastructure Engineer (DevOps),TOKENINSIGHT SG PTE. LTD.,https://www.mycareersfuture.gov.sg/job/engineering/blockchain-infrastructure-engineer-tokeninsight-sg-fa3b50aa8b94441d9350ab2e6cdeb510?source=MCF&event=Search,"Roles & Responsibilities
Responsibilities
Deploy, maintain, and optimize self-hosted blockchain full nodes to ensure high availability and stability.
Evaluate, procure, and monitor third-party blockchain SaaS services, ensuring they meet operational and security requirements.
Track blockchain community updates (e.g., GitHub, developer forums, core development teams) to stay informed on network upgrades and security patches.
Develop and maintain automated blockchain infrastructure management tools using Infrastructure as Code (IaC) frameworks.
Build full-node management platforms to automate deployment, monitoring, scaling, and security hardening.
Oversee on-chain application management, including wallets, DeFi integrations, and blockchain analytics services.
Provide technical support for internal teams and partners, resolving blockchain infrastructure-related issues.
Implement security best practices to protect blockchain networks, ensuring resilience against threats.
Requirements
Bachelor's degree in Computer Science or related fields, with 5+ years of DevOps or infrastructure experience and at least 2 years in blockchain infrastructure.
Proficiency in Golang, with strong coding, debugging, and system design capabilities.
Deep understanding of Linux system internals, L4/L7 networking, and distributed system architectures.
Experience with Terraform and Infrastructure as Code (IaC) tools.
Familiarity with major blockchain networks (e.g., Bitcoin, Ethereum, Solana, TON) and their full-node operations.
Strong analytical skills, self-driven, and problem-solving mindset.
Preferred Qualifications
Experience in public blockchain development or in-depth knowledge of blockchain protocol source code.
Hands-on experience working with leading blockchain node SaaS providers (e.g., Alchemy, Infura, QuickNode, GetBlock, Ankr).
Background in developing blockchain applications (e.g., wallets, smart contracts, DeFi, node management platforms, on-chain analytics).
Active contributor to blockchain open-source communities or experience in governance proposals."
IT & DevOps Manager,INNOEDGE LABS PTE. LTD.,https://www.mycareersfuture.gov.sg/job/information-technology/devops-manager-innoedge-labs-f524dceb3bf7ed4e159912d75c92c295?source=MCF&event=SuggestedJob,"Roles & Responsibilities
At InnoEdge, we’re on a mission to protect organisations from ever-evolving cyber threats. While our core teams focus on cutting-edge research and defence, our internal IT environment—and the infrastructure that powers our engineering workflows—needs to be just as secure, resilient, and future-ready.
We’re looking for a hands-on IT & DevOps Manager to lead and support internal IT operations and drive the evolution of our development infrastructure. This role is critical in ensuring both a robust IT backbone and a responsive, frictionless experience for our researchers and developers. You will roll up your sleeves to configure systems, solve complex technical issues, and implement solutions directly.
This is not a purely managerial role—we’re looking for someone who thrives on getting into the weeds of technical work, while also thinking ahead to how we can build smarter, faster, and more scalable systems. As we look to grow and mature our DevOps capabilities, you’ll play a leading role in shaping the roadmap and helping us adopt new tools and practices.
We foster a collaborative culture built on curiosity, continuous learning, and the drive to do impactful work. Whether you're automating systems, solving infrastructure challenges, or supporting high-performance teams, you’ll be a key enabler of our mission.
Responsibilities
Lead and execute all aspects of internal IT and DevOps operations—this is a hands-on technical role
Perform configuration, setup, maintenance, and troubleshooting of systems, networks, and development infrastructure
Oversee preventive maintenance and long-term IT planning; drive infrastructure and tooling initiatives
Establish and implement IT and IT Security policies; ensure compliance across the organisation
Maintain and support endpoints, servers, and network infrastructure
Manage key systems including Microsoft 365, Active Directory, Group Policy, VMware ESXi, enterprise SAN storage, and backup solutions
Partner with researchers and developers to provide secure, efficient, and well-integrated development environments
Support and improve development workflows (e.g., version control, build/test environments, CI/CD pipelines)
Explore and drive the future adoption of DevOps practices such as Infrastructure-as-Code, containerization, and observability/monitoring
Create scripts and lightweight tools to automate repetitive tasks and improve system management
Manage inventory and support cost-effective procurement of IT and development hardware/software
Supervise internal IT staff (if any) and manage relationships with vendors
Diagnose and troubleshoot issues across IT systems and development environments
Collaborate with team leads and stakeholders to identify technical needs and plan for solutions
Requirements
Strong experience in hands-on IT operations and infrastructure management
Proven ability to directly support technical teams—especially developers and researchers—in fast-moving environments
Willingness and ability to work hands-on: configuring systems, troubleshooting issues, and implementing solutions yourself
Solid knowledge and experience with:
Microsoft 365, Active Directory, Group Policy
Networking and server administration
VMware ESXi, SAN storage, and backup solutions
Windows and Linux environments
Version control systems (e.g., Git), and basic CI/CD workflows
Excellent troubleshooting and problem-solving skills
Experience working with vendors and outsourced IT support
Strong project management, planning, and communication skills
A proactive mindset, with interest in evolving toward infrastructure automation and observability
Passion for improving the day-to-day experience of technical teams and enabling their best work
Only Singaporean citizens will be considered, and the offer is subjected to G50 security clearance as required by clients
Benefits
Training & Development
Bonus Scheme (Subject to performance)
Medical Benefits
Hybrid Work Arrangements"
DevOps Engineer (QA),KRIS INFOTECH PTE. LTD.,https://www.mycareersfuture.gov.sg/job/information-technology/devops-engineer-kris-infotech-f12cccbd2d5193be90f9adcc0278add7?source=MCF&event=Search,"Roles & Responsibilities
Job Description:
Research, design, and develop computer software or specialised utility programs.
Develop and maintain automation tools for infrastructure provisioning, configuration management, and deployment and quality assurance.
Collaborate with development teams to implement CI/CD pipelines and automate deployment as well as test processes.
Work on the industrialization of test management.
Work on the management of OT DeKOT environments.
Work on the preparation/industrialization of the transition to Run mode of Orchestrade for Treasury.
Monitor and troubleshoot infrastructure and application performance issues.
Implement security best practices and ensure compliance with industry standards.
Contribute to the development and improvement of our DevOps culture and processes.
Design and develop comprehensive quality assurance strategies and frameworks.
Implement automated testing systems to ensure reusability and efficiency.
Design and implement comprehensive test plans and test cases based on requirements and design documentation. Develop automated test systems to ensure reusability and efficiency.
Promote and implement testing methodologies, aiming to identify and address defects early in the development lifecycle.
Provide technical support to other teams, assisting with problems encountered internally, such as system malfunctions. Propose solutions, suggest improvements, and contribute to data analysis.
Document all testing activities, including test results, discovered defects, and any relevant observations. Prepare detailed reports for management and the Delivery Team
Stay up-to-date with the latest DevOps technologies and trends.
This position will be an important pillar of Support Orchestrade for Treasury. Gradually, this position will perform application support for users (Front to BO).
Requirements:
Candidates should have minimum 5 years experience in relevant activities.
Technical
Good knowledge in UNIX platform and database management systems such as SQL, Oracle, Sybase.
Development in C# .net a must have
Experience with automation frameworks and libraries.
Proficiency in scripting languages such as Python, Shell script and PowerShell.
Good exposure to DevOps tools & technologies like Gitlab, Ansible, Jenkins, Maven, Elastic Search, Grafana, Prometheus, Kibana, Control-M, KAFKA, Confluence, Jira, and MQ Series and test automation tools like Selenium (and other test automation frameworks), cucumber etc.
Experience with Docker/Kurbernetes.
Knowledge of Cloud platforms and services.
.net and Azure devops.
Functional
Experience in supporting capital market applications and trading systems, ideally within the dynamic landscape of Treasury and Fixed Income Front Office operations with a commendable grasp of financial products (Treasury, FX, Credit, IRD, Bonds, RSF etc.)
Nice to Have
Experience in supporting banking applications and trading systems.
Domain-Driven design and Microservices: Springboot.
Other Professional Skills and Mindset
Excellent communication and interpersonal skills to effectively collaborate with diverse teams.
Excellent problem-solving and analytical skills.
Ability to work under pressure.
Appetite to follow technology trend and participate to communities.
Eagerness to learn and adapt to new technologies.
Strong perseverance and diligence towards attaining goals and effective time management
Passion for sharing expertise and grow team members’ skills.
Autonomous, self-motivated and excellent team player
Ability and flexibility to work with cross-geographical teams operating in different time zones."
