title,company,url,description
Cloud Platform Engineer (AWS / DevOps),ALLEGIS GROUP SINGAPORE PRIVATE LIMITED,https://www.mycareersfuture.gov.sg/job/banking-finance/cloud-platform-engineer-allegis-group-singapore-d6ae1d86d987c393f36806bf72cf20c4?source=MCF&event=Search,"Roles & Responsibilities
Location: Singapore (Hybrid – 4 days in office)
TEKsystems is a leading provider of technology consulting, committed to delivering innovative solutions and exceptional service to our clients. We’re hiring a Cloud Platform Engineer to join a high-performing tech team at a leading institutional investment firm.
🌐 About the Role
You'll help build and scale a secure, cloud-native developer platform used by hundreds of backend engineers. This is part of a multi-year cloud transformation initiative designed to enhance developer efficiency and internal platform reliability.
If you're an ex-software engineer who transitioned into DevOps or platform engineering — and you’re passionate about solving developer pain points at scale — this role is for you!
🛠 What You’ll Do
Build and support an internal cloud development platform as part of a cross-functional engineering team
Collaborate with backend developers to understand workflows and improve developer experience
Deploy and manage infrastructure on AWS using tools like Terraform, Docker, Kubernetes (EKS)
Develop automation pipelines and CI/CD workflows using GitHub Actions, Jenkins, or similar tools
Integrate monitoring and logging tools like CloudWatch, Datadog, Splunk for observability
Maintain system performance, troubleshoot issues, and support platform scaling
Work closely with engineering teams across departments to enable smooth cloud migration and adoption
✅ What We’re Looking For
We’re looking for someone with a strong software development background who has transitioned into DevOps or platform engineering.
Must-Have Skills:
4–5 years of experience in software engineering (Java, JavaScript, Python, or .NET)
2+ years of hands-on experience with AWS (EKS, EC2, IAM, S3, VPC, etc.)
Proficiency in containerization tools: Docker, Kubernetes, Helm
Strong Linux administration and shell scripting skills
Experience with Infrastructure-as-Code (Terraform or CloudFormation)
Familiarity with CI/CD tools (e.g. GitHub Actions, GitLab CI, Jenkins)
Working knowledge of logging/monitoring tools like Datadog, Splunk, CloudWatch
Strong problem-solving skills and ability to work across teams
Nice-to-Haves:
Experience in cloud migration or internal developer platforms
Experience with artifact management tools (e.g., JFrog Artifactory)
Strong communication and documentation skills
🧠 Who Will Succeed in This Role?
This role is ideal for someone who:
Has transitioned from backend development into DevOps/platform engineering
Enjoys solving technical challenges that improve developer productivity
Can explain systems clearly and collaborate across departments
Brings a deep understanding of cloud infrastructure and developer workflows
🌟 Why Join?
Join a tech-driven, well-funded institution on a multi-year cloud transformation
Be part of a team where engineers have the freedom to innovate and improve developer platforms
Work on enterprise-scale systems with the latest cloud-native technologies.
We regret to inform that only shortlisted candidates will be notified.

EA registration number : Garey Gan Chia Wen, R24124837

Allegis Group Singapore Pte Ltd, Company Reg No. 200909448N, EA License No. 10C4544"
Senior DevOps Engineer,TALENTSIS PTE. LTD.,https://www.mycareersfuture.gov.sg/job/engineering/senior-devops-engineer-talentsis-96ef67f316b24ca989a3ed1784dca6e5?source=MCF&event=Search,"Roles & Responsibilities
Company’s Profile:
Our client is an international technology and engineering company that specialises in providing innovative digital and security solutions to their esteemed clients. They are well-known for their dedication of quality delivery standards with more than 15,000 engineers globally supporting projects. They have an international presence in over 100 countries worldwide and are looking out for DevOps Engineers to join their team and contribute to their ongoing success.

Location: Ang Mo Kio/Yio Chu Kang area

Job Responsibilities:
Design, implement, and manage CI/CD pipelines to automate software deployment.
Maintain, monitor, and enhance cloud-based infrastructure (AWS, Azure, or GCP).
Develop and manage Infrastructure as Code (IaC) using Terraform, Ansible, or CloudFormation.
Implement containerization and orchestration using Docker and Kubernetes.
Ensure system security and compliance by applying best security practices.
Monitor system performance and troubleshoot issues to maintain uptime and reliability.
Automate repetitive tasks to improve operational efficiency.
Collaborate with developers, security teams, and IT operations to streamline workflows.
Implement logging, monitoring, and alerting using tools like Prometheus, Grafana, ELK Stack, or Datadog.
Maintain version control and source code management tools such as Git and GitHub/GitLab.

Requirements:
At least 3 years’ DevOps Engineer work experience
Proficiency in scripting languages such as Python, Bash, Shell, or Go
Any Cloud certification (AWS / Azure / GCP) will be a strong advantage

Interested candidates may whatsapp your resume to 6421 4965. Only shortlisted applicants will be contacted.
Cassie Chan | R2197426
Talentsis Pte Ltd | EA No: 20C0312"
Cloud DevOps Engineer,TALENTSIS PTE. LTD.,https://www.mycareersfuture.gov.sg/job/engineering/cloud-devops-engineer-talentsis-60471dda84500d46543ee81f422ae344?source=MCF&event=Search,"Roles & Responsibilities
Company’s Profile:
Our client is an international technology and engineering company that specialises in providing innovative digital and security solutions to their esteemed clients. They are well-known for their dedication of quality delivery standards with more than 15,000 engineers globally supporting projects. They have an international presence in over 100 countries worldwide and are looking out for System Engineers to join their team and contribute to their ongoing success.

Location: Ang Mo Kio/Yio Chu Kang area

Job Responsibilities:
Design, build, and maintain AWS infrastructure using infrastructure as code (IaC) tools like GitLab, Terraform, Sentinel and Ansible.
Improve efficiency and robustness of Control Tower/Landing Zone pipelines, workflows, Lambda functions and CloudFormation stacks/stacksets.
Continuously improve operation excellence and efficiency by automating routine tasks using AWS native tools like AWS Lambda, Step Functions, and AWS Systems Manager.
Collaborate with Enterprise Application engineers to ensure that automation tasks are aligned with business requirements.
Troubleshoot and debug issues related to AWS resources and infrastructure.
Implement security measures to protect AWS resources.

Requirements:
At least 3 years’ DevOps Engineer work experience
Technical knowledge on RHEL or Windows Operating System
Any Cloud certification (AWS / Azure / GCP) will be a strong advantage

Interested candidates may whatsapp your resume to 6421 4965. Only shortlisted applicants will be contacted.
Cassie Chan | R2197426
Talentsis Pte Ltd | EA No: 20C0312"
Senior / DevOps Engineer,NCS PTE. LTD.,https://www.mycareersfuture.gov.sg/job/engineering/senior-devops-engineer-ncs-9d88d1ca8889e111c231b94017a51b3c?source=MCF&event=Search,"Roles & Responsibilities
NCS is a leading technology services firm that operates across the Asia Pacific region in over 20 cities, providing consulting, digital services, technology solutions, and more. We believe in harnessing the power of technology to achieve extraordinary things, creating lasting value and impact for our communities, partners, and people. Our diverse workforce of 13,000 has delivered large-scale, mission-critical, and multi-platform projects for governments and enterprises in Singapore and the APAC region.

We are seeking a highly skilled DevSecOps Engineer with strong expertise in managing large scale containers using orchestration platform such as Kubernetes, Tanzu, Docker Swarm or other similar products. The candidate should have good understanding of microservices architecture, and familiar with deploying and using services such as RabbitMQ, Kafka, Elasticsearch, Zookeeper, Redis, flink etc. The role requires experience in containerization, built and maintain CI/CD pipelines using GitLab or Jenkins, good networking skills in VLAN, switching, routing and basic knowledge of AI and video analytics technologies. Additionally, the candidate should be familiar with Linux OS, Python, and Bash scripting.

What will you do?
Architecture & System Design
Design, deploy, and maintain scalable, highly available microservices architecture
Ensure fault-tolerant infrastructure and maximum uptime in production environments
Implement event-driven and message-driven architecture (Nice-to-Have)
Containerization & Orchestration
Build and manage containerized applications using Docker
Deploy and orchestrate applications using Kubernetes, Tanzu, or Docker Swarm
CI/CD & Automation
Configure and maintain CI/CD pipelines using GitLab or Jenkins
Develop automation scripts using Python, Bash, or PowerShell
Automate deployments, monitoring, and server management tasks
Messaging & Data Processing
Work with message brokers like RabbitMQ, ActiveMQ
Deploy and manage Kafka, Elasticsearch, Zookeeper, Redis
Experience with data processing technologies like Apache Flink, Spark
Monitoring, Troubleshooting & Security
Monitor infrastructure health and performance
Conduct root cause analysis and resolve issues in distributed systems
Apply DevSecOps best practices (Nice-to-Have)
Operating Systems & Networking
Administer Linux-based systems and perform necessary scripting tasks
Understand networking concepts (VLANs, switching, routing)
Emerging Tech & Tools (Nice-to-Have)
Basic understanding of AI concepts and video analytics technologies (e.g., OpenCV, FFmpeg)
Experience with cloud platforms like AWS, GCP, or Azure
Collaboration & Communication
Collaborate cross-functionally with other technical teams
Communicate effectively and contribute in a fast-paced, agile environment
The ideal candidate should possess:
Technical Skills & Experience
Strong experience in microservices architecture and distributed systems
Expertise in containerization with Docker and orchestration using Kubernetes, Tanzu, or Docker Swarm
Proven ability to build and maintain CI/CD pipelines using GitLab or Jenkins
Hands-on experience with message brokers like RabbitMQ or ActiveMQ
Proficiency in big data technologies such as Kafka, Elasticsearch
Familiarity with data processing tools like Apache Flink, Apache Spark
Scripting skills in Python, Bash, and PowerShell for automation and server management
Working knowledge of Linux-based OS for managing servers and deployment environments
Solid understanding of networking fundamentals: VLANs, switching, routing
Experience with cloud platforms (AWS, GCP, or Azure) is an advantage
Familiarity with DevSecOps practices
Exposure to AI and video analytics technologies such as OpenCV or FFmpeg is a plus
Knowledge of event-driven and message-driven architecture is desirable
Soft Skills
Excellent problem-solving and analytical capabilities
Strong communication and collaboration skills
Ability to thrive in a fast-paced, cross-functional team environment
High attention to detail with a focus on quality delivery
We are driven by our AEIOU beliefs—Adventure, Excellence, Integrity, Ownership, and Unity—and we seek individuals who embody these values in both their professional and personal lives. We are committed to our Impact: Valuing our clients, Growing our people, and Creating our future.

Together, we make the extraordinary happen.

Learn more about us at ncs.co and visit our LinkedIn career site."
Senior DevOps Engineer / SRE Engineer,GOSSTECH PTE. LTD.,https://www.mycareersfuture.gov.sg/job/information-technology/senior-devops-engineer-sre-engineer-gosstech-0160ae573f6b2cb12c80ffacd9f4bd91?source=MCF&event=Search,"Roles & Responsibilities
Job Responsibilities:
Responsible for the management of Site Reliability Engineering, have hands-on knowledge on manage & troubleshot server, network and applications;
Responsible for the deployment and daily monitoring of the company's business systems to ensure the normal operation and emergency response;
Provide in-depth understanding of the operation and maintenance architecture, good at architecture design, performance optimization, platform security; Responsible for the improvement of the operation and maintenance team skills, to ensure the professional level of the operation and maintenance team.
Establish and improve standardized operation systems for DevOps team. Use a sound management strategies and security strategies to ensure the quality of operation and maintenance;
Job Requirements:
Familiar with automation deployment, proficient in how to build the most of popular monitoring system in the market. SVN/Git version control system and proficient in CICD configuration;
Hands-on knowledge in Nginx configuration, Load balancer (SLB) configuration. Familiar with Node.js running environment will be an advantage.
Skilled in managing Linux systems and security, with experience in operation and maintenance of large websites or web application platforms;
Understand common knowledge about the network, familiar with firewall, VPN, DHCP, DNS and other network technologies. Familiar with high availability/load balancing technology will be an advantage;
High sense of responsibility, strong ability to analyze and eliminate faults, good at learning at work, able to withstand work stress;
Understand the penetration test, have experience in safe operation and maintenance, and have working experience in Cloud platforms (AZURE, AWS or Google);
Working Environments: Hyper-Cloud, Cloudform/AWX, ELK, Zabbix, Jenkins/VSTS, GitLab etc. We build together, We learn together.
Candidate must possess at least Bachelor's Degree/Post Graduate Diploma/Professional Degree in Engineering (Computer/Telecommunication), Engineering (Electrical/Electronic), Computer Science/Information Technology or equivalent.
At least 3 years of working experience in the related field is required for senior position.
Preferably Senior Executive specialized in IT/Computer - Network/System/Database Admin or equivalent.
What we offer:
Proper training will provide to the senior position
Attractive rewards for long-term service staff
Energetic and friendly working environment (flexible working hours, quarterly events, staff birthday celebration and etc.)
Medical insurance"
Junior DevOps Engineer / SRE Engineer,GOSSTECH PTE. LTD.,https://www.mycareersfuture.gov.sg/job/information-technology/junior-devops-engineer-sre-engineer-gosstech-fd3345c590b439ee2196e4b4e504cb30?source=MCF&event=Search,"Roles & Responsibilities
Job Responsibilities:
Responsible for the management of Site Reliability Engineering, have hands-on knowledge on manage & troubleshot server, network and applications;
Responsible for the deployment and daily monitoring of the company's business systems to ensure the normal operation and emergency response;
Provide in-depth understanding of the operation and maintenance architecture, good at architecture design, performance optimization, platform security; Responsible for the improvement of the operation and maintenance team skills, to ensure the professional level of the operation and maintenance team.
Job Requirements:
Familiar with automation deployment, proficient in how to build the most of popular monitoring system in the market. SVN/Git version control system and proficient in CICD configuration;
Hands-on knowledge in Nginx configuration, Load balancer (SLB) configuration. Familiar with the Node.js running environment will be an advantage.
Skilled in managing Linux systems and security, with experience in operation and maintenance of large websites or web application platforms will be an advantage;
Understand common knowledge about the network, familiar with firewall, VPN, DHCP, DNS and other network technologies. Familiar with high availability/load balancing technology will be an advantage;
High sense of responsibility, strong ability to analyze and eliminate faults, good at learning at work, able to withstand work stress;
Understand the penetration test, have experience in safe operation and maintenance and have working experience in AZURE, AWS or Google Cloud platforms;
Working Environment: Hyper-Cloud, Cloudform/AWX, ELK, Zabbix, Jenkins/VSTS, GitLab etc. We build together, We learn together.
Candidate must possess at least Bachelor's Degree/Post Graduate Diploma/Professional Degree in Engineering (Computer/Telecommunication), Engineering (Electrical/Electronic), Computer Science/Information Technology or equivalent.
At least 1 years of working experience in the related field is required for junior position.
What we offer:
Proper training will provide to the junior position.
Attractive rewards for long-term service staff
Energetic and friendly working environment (flexible working hours, quarterly events, staff birthday celebration and etc.)
Medical insurance"
DevOps Engineer / SRE,GOSSTECH PTE. LTD.,https://www.mycareersfuture.gov.sg/job/information-technology/devops-engineer-sre-gosstech-75a959639eed37496c324a863618f9bb?source=MCF&event=Search,"Roles & Responsibilities
Job Responsibilities:
Responsible for the management of Site Reliability Engineering, have hands-on knowledge on manage & troubleshot server, network and applications;
Responsible for the deployment and daily monitoring of the company's business systems to ensure the normal operation and emergency response;
Provide in-depth understanding of the operation and maintenance architecture, good at architecture design, performance optimization, platform security; Responsible for the improvement of the operation and maintenance team skills, to ensure the professional level of the operation and maintenance team.
Establish and improve standardized operation systems for DevOps team. Use a sound management strategies and security strategies to ensure the quality of operation and maintenance;
Job Requirements:
Familiar with automation deployment, proficient in how to build the most of popular monitoring system in the market. SVN/Git version control system and proficient in CICD configuration;
Hands-on knowledge in Nginx configuration, Load balancer (SLB) configuration. Familiar with Node.js running environment.
Skilled in managing Linux systems and security, with experience in operation and maintenance of large websites or web application platforms;
Understand common knowledge about the network, familiar with firewall, VPN, DHCP, DNS and other network technologies, familiar with high availability/load balancing technology;
High sense of responsibility, strong ability to analyze and eliminate faults, good at learning at work, able to withstand work stress;
Understand the penetration test, have experience in safe operation and maintenance, and have working experience in AZURE, AWS or Google Cloud platforms;
Required Skill(s): redis, zabbix, elasticsearch,KBS,HAProxy,Jenkins
Candidate must possess at least Bachelor's Degree/Post Graduate Diploma/Professional Degree in Engineering (Computer/Telecommunication), Engineering (Electrical/Electronic), Computer Science/Information Technology or equivalent.
Required language(s): English, Mandarin (Good communication skills in Mandarin language to handle Mandarin speaking customers’ enquires & conduct trouble shooting based on customers’ feedback)
At least 1 year of working experience in the related field is required for junior position. Shift work may be required.
Preferably Senior Executive specialized in IT/Computer - Network/System/Database Admin or equivalent.
What we offer:
Attractive rewards for long-term service staff
Energetic and friendly working environment (flexible working hours, quarterly events, staff birthday celebration and etc.)
Medical insurance"
DevOps Engineer,CLPS TECHNOLOGY (SINGAPORE) PTE. LTD.,https://www.mycareersfuture.gov.sg/job/information-technology/devops-engineer-clps-technology-190e89ce7ec36d9ee62f5dd5cda3f309?source=MCF&event=Search,"Roles & Responsibilities
• Should Research, design, and develop computer software or specialised utility programs.
• Develop and maintain automation tools for infrastructure provisioning, configuration management, and deployment and quality assurance.
• Collaborate with development teams to implement CI/CD pipelines and automate deployment as well as test processes.
• Work on the industrialization of test management.
• Good knowledge in UNIX platform and database management systems such as SQL, Oracle, Sybase.
• Development in C# .net a must have
• Experience with automation frameworks and libraries.
• Proficiency in scripting languages such as Python, Shell script and PowerShell.
• Good exposure to DevOps tools & technologies like Gitlab, Ansible, Jenkins, Maven, Elastic Search, Grafana, Prometheus, Kibana, Control-M, KAFKA, Confluence, Jira, and MQ Series and test automation tools like Selenium (and other test automation frameworks), cucumber etc."
DevOps Engineer,TRIPLE A TECHNOLOGIES PTE. LTD.,https://www.mycareersfuture.gov.sg/job/engineering/devops-engineer-triple-technologies-4ee9ea43471e51ab63865a9bea87912f?source=MCF&event=SuggestedJob,"Roles & Responsibilities
About Triple-A
Triple-A is a global payment institution licensed in the United States, Europe, and Singapore, enabling businesses worldwide to pay and get paid in both local and digital currencies.

We empower businesses to reach over 560M digital currency owners, boost revenue, and optimise costs through stablecoin and cryptocurrency payments, while eliminating volatility, custody, and compliance risks. Our commitment is to build a more efficient, inclusive global payment ecosystem by bridging the gap between local and digital currencies.

Registered with the United States Financial Crimes Enforcement Network (FinCEN), licensed by the Monetary Authority of Singapore (MAS), and Banque de France’s ACPR in Europe, Triple-A is trusted by over 20,000 businesses worldwide to make global crypto payments simple, secure, and cost-effective. For more information, visit www.triple-a.io.

Join the team
We are a dynamic and passionate team building towards a more efficient global payment ecosystem. We are actively bridging the gaps in cross-border payments, between traditional & digital currencies, and web2 and web3.

Guided by our CEO, Eric Barbier who brings 20 years of experience and a proven track record in building and scaling payment companies worldwide, Triple-A is growing our team. If you're bold, tenacious, and creative, we believe you'd be a perfect match for us!

Roles & Responsibilities:
Collaborate closely with development and operations teams to integrate security practices into the DevOps pipeline
Design, implement and maintain secure infrastructure as code using tools like Terraform, Ansible, etc.
Automate security testing and compliance checks as part of CI/CD pipelines
Monitor, investigate and respond to potential security incidents and vulnerabilities
Perform secure code reviews and static/dynamic application security testing (SAST/DAST)
Provide security training and mentorship to cross-functional teams
Stay updated on latest security threats, tools and mitigation techniques
Required Skills & Experience:
Bachelor's degree in computer science, cybersecurity or related field
Minimum 2 years of experience in a DevOps or DevSecOps role
Strong scripting skills in languages like Bash, Perl, Python, etc.
Hands-on experience with cloud security best practices on AWS/GCP/Azure
Working knowledge of containerization tools like Kubernetes and Docker
Familiarity with security tools like SonarQube, OWASP ZAP, Snyk, etc.
Understanding of security protocols like SSL/TLS, encryption, RBAC, etc.
Experience with automation tools like Ansible, Terraform, etc.
Knowledge of security frameworks like NIST, ISO 27001, CIS Benchmarks
Strong problem-solving and debugging abilities
Excellent written and verbal communication skills
Preferred Skills:
Cloud security certifications
Experience in the blockchain networks or fintech industry
Knowledge of GDPR and other relevant security regulations"
Middleware Engineer with Devops,INNOVATIQ TECHNOLOGIES PTE. LTD.,https://www.mycareersfuture.gov.sg/job/information-technology/middleware-engineer-devops-innovatiq-technologies-9f3477838a73635c02182bf15ddea90d?source=MCF&event=Search,"Roles & Responsibilities
Key Responsibilities:
Design and implement robust middleware solutions using industry-standard technologies.
Apply DevOps practices to support automation and continuous integration/deployment pipelines.
Maintain and monitor middleware systems to ensure high availability and performance.
Develop and maintain scripts for automation and configuration management.
Collaborate with cross-functional teams to ensure system reliability and scalability.
Requirements:
Minimum 6 years of experience in Middleware Engineering with DevOps exposure.
Hands-on expertise in Terraform, Ansible, GitHub, and middleware components (Application Server).
Strong understanding of DevOps principles, CI/CD processes, and infrastructure automation.
Proficient in scripting for system automation and orchestration.
Experience working with cloud platforms and modern deployment strategies."
