title,company,url,description
Software Quality Engineer,ACTIVATE INTERACTIVE PTE LTD,https://www.mycareersfuture.gov.sg/job/information-technology/software-quality-engineer-activate-interactive-e84e49b354cd3f3f7bea83b6f4b40360?source=MCF&event=Search,"Roles & Responsibilities
Activate Interactive Pte Ltd (“Activate”) is a leading technology consultancy headquartered in Singapore with a presence in Malaysia and Indonesia. Our clients are empowered with quality, cost-effective, and impactful end-to-end application development, like mobile and web applications, and cloud technology that remove technology roadblocks and increase their business efficiency.
We believe in positively impacting the lives of people around us and the environment we live in through the use of technology. Hence, we are committed to providing a conducive environment for all employees to realise their full potential, who in turn have the opportunity to continuously drive innovation.
We are searching for our next team members to join our growing team.
If you love the idea of being part of a growing company with exciting prospects in mobile and web technologies that create positive impact on people’s lives, then we would love to hear from you.
Co-Development Business Unit is looking for Software Quality Engineer
Internal Code: A25019
This is a one-year contract role
We are seeking a highly skilled and motivated Software Quality Assurance Engineer to join our dynamic tech team.
In this role, you will be instrumental in ensuring the quality and reliability of our platform, working closely with cross-functional teams to implement robust testing strategies and drive continuous improvement in our development processes
What will you do?
Test Strategy and Planning:
Develop and implement comprehensive QA strategies that cover all aspects of the software development lifecycle.
Design, maintain, and execute test plans, test cases, and test scripts for both manual and automated testing.
Automation and Tooling:
Lead the development of automated testing frameworks using Cypress/Playwright for end-to-end testing.
Implement performance and load testing using tools like Gatling, K6, and Autocannon to ensure platform scalability.
Quality Assurance:
Conduct contract testing with Pact.js to validate interactions between microservices.
Perform thorough regression testing when bugs are resolved and new features are implemented.
Collaborate with developers to ensure code quality and adherence to best practices.
Maintaining the E2E pipeline and promptly addressing any issues to prevent blocking or delays.
Cross-Functional Collaboration:
Work closely with product managers, developers, and DevOps engineers to understand requirements and deliver high-quality software.
Participate in agile ceremonies, providing QA insights and contributing to sprint planning.
Collaborate with other QEs and team members to prepare the weekly deployment and lead the deployment activities.
Issue Resolution and Reporting:
Identify, document, and track software defects using industry-standard tools.
Conduct root cause analysis for critical issues and implement corrective actions.
Provide regular reports on QA activities, test results, and quality metrics.
Mentorship and Leadership:
Mentor junior QA engineers, fostering a culture of quality and continuous improvement.
Stay updated with emerging QA technologies and methodologies, introducing relevant innovations to the team.
What are we looking for?
Bachelor's degree in Computer Science, Software Engineering, or a related field.
Minimum of 5 years of professional experience in Software Quality Assurance.
Proven experience with automation testing, particularly using Cypress for E2E testing.
Hands-on experience with performance testing tools like Gatling and Autocannon.
Experience with contract testing frameworks such as Pact.js.
Proficiency in JavaScript (TypeScript) and familiarity with Go
Solid understanding of frontend and backend technologies, including ReactJS, ExpressJS, and Gin-gonic.
Experience with AWS services, Docker, and Kubernetes.
Familiarity with CI/CD pipelines using GitLab and ArgoCD.
Knowledge of relational databases (MySQL, PostgreSQL) and caching solutions (Redis).
Understanding of REST API, GraphQL API, JWT authentication, and Elasticsearch.
Experience with logging and monitoring tools like Splunk or OpenSearch.
Strong analytical and problem-solving abilities.
Excellent communication skills, both verbal and written.
Ability to work collaboratively in a fast-paced, agile environment.
Leadership qualities with the ability to mentor and guide team members.
What do we offer?
Fun working environment
Employee Wellness Program
Does it sound like something you are interested in exploring further? Please be in touch with our team for an initial chat at careers@activate.sg
Activate Interactive Singapore is an equal opportunity employer. Employment decisions will be based on merit, qualifications and abilities. Activate Interactive Pte Ltd does not discriminate in employment opportunities or practices on the basis of race, colour, religion, gender, sexuality, national origin, age, disability, marital status or any other characteristics protected by law.
Protecting your privacy and the security of your data are longstanding top priorities for Activate Interactive Pte Ltd.
Your personal data will be processed for the purposes of managing Activate Interactive Pte Ltd’s recruitment related activities, which include setting up and conducting interviews and tests for applicants, evaluating and assessing the results, and as is otherwise needed in the recruitment and hiring processes.
Please consult our Privacy Notice (https://www.activate.sg/privacy-policy) to know more about how we collect, use, and transfer the personal data of our candidates. Here you can find how you can request for access, correction and/or withdrawal of your Personal Data."
DevOps Engineer,CLPS TECHNOLOGY (SINGAPORE) PTE. LTD.,https://www.mycareersfuture.gov.sg/job/information-technology/devops-engineer-clps-technology-190e89ce7ec36d9ee62f5dd5cda3f309?source=MCF&event=SuggestedJob,"Roles & Responsibilities
• Should Research, design, and develop computer software or specialised utility programs.
• Develop and maintain automation tools for infrastructure provisioning, configuration management, and deployment and quality assurance.
• Collaborate with development teams to implement CI/CD pipelines and automate deployment as well as test processes.
• Work on the industrialization of test management.
• Good knowledge in UNIX platform and database management systems such as SQL, Oracle, Sybase.
• Development in C# .net a must have
• Experience with automation frameworks and libraries.
• Proficiency in scripting languages such as Python, Shell script and PowerShell.
• Good exposure to DevOps tools & technologies like Gitlab, Ansible, Jenkins, Maven, Elastic Search, Grafana, Prometheus, Kibana, Control-M, KAFKA, Confluence, Jira, and MQ Series and test automation tools like Selenium (and other test automation frameworks), cucumber etc."
"Cloud Devops Engineer (AWS, Kubernetes, CI / CD) #IJJ",RECRUIT EXPRESS PTE LTD,https://www.mycareersfuture.gov.sg/job/information-technology/cloud-devops-engineer-ijj-recruit-express-5ffca43fdb2e6066026e0ada245cb01d?source=MCF&event=Search,"Roles & Responsibilities
To provide operational support for the overall Agile DevOps Platform, which includes:
· Drive thought leadership in DevOps practices
· Work closely with Machine Learning Engineers to automate model training, testing and deployment into production using Continuous Integration/Continuous Delivery (CI/CD)
· Hands on implementation and maintenance of CI/CD pipelines
· Work closely with Security Architect to integrate security best practice into the pipeline
· Identify and resolve problems in a timely fashion
· Maintenance and upgrading of platform tools
· Continuous monitoring of health of Agile products

Requirements:

· 5+ Years experience in AWS Services, EKS, Kibana
· Well-versed in agile ways of working and familiar with common tools including JIRA and Confluence
· Experience in working in cross-functional Agile teams
· A strong technical foundation in the following:
· Good working experience with cloud-based technologies and architectures (AWS, Azure or GCP). AWS know-how is preferred
· Experience with CI/CD practices and systems (e.g. git, git flow, trunk-based development).
· Experience and good knowledge of Containerization (docker etc.)
· Container orchestration using Kubernetes
· Scripting language (shell, ruby/jruby, perl, python, powershell etc.)
· Monitoring and data collection tools (nagios, splunk, and etc.)
· SCM tools (git, bitbucket)
· Build tools (ant, nant, rake, etc.)
· Packet management (rpm, npm and etc.)
· Configuration management tools (Ansible, chef, Terraform, puppet etc.)
· Microservices architecture

Interested applicants please send your resume in MS Word format to janeng@recruitexpress.com.sg

Jane Ng Wei Ling
R1104585
Recruit Express Pte Ltd
EA License No: 99C4599
RCB No.: 199601303W"
DevOps Platform Engineer (Capital Markets) | Bank | Contract,MANPOWER STAFFING SERVICES (SINGAPORE) PTE LTD,https://www.mycareersfuture.gov.sg/job/information-technology/devops-platform-engineer-bank-contract-manpower-staffing-services-b562a1e40ea39ef7a77fa5a5aa9a153c?source=MCF&event=Search,"Roles & Responsibilities
Job Scope:
As a DevOps Platform Engineer, you will be responsible for designing, implementing, and maintaining the infrastructure and automation tools. You will work closely with development teams to ensure smooth deployment and operation of the applications. You will be a key contributor to the continuous improvement efforts, ensuring the environments are always reliable, secure, and efficient.

Main Responsibilities:
Research, design, and develop computer software or specialised utility programs.
Develop and maintain automation tools for infrastructure provisioning, configuration management, and deployment.
Collaborate with development teams to implement continuous integration/continuous delivery (CI/CD) pipelines and automate deployment processes.
Monitor and troubleshoot infrastructure and application performance issues.
Implement security best practices and ensure compliance with industry standards.
Stay up to date with the latest DevOps technologies and trends.
Contribute to the development and improvement of the DevOps culture and processes.
Job Qualifications:
Master's or Bachelor’s Degree in Computer Science / Information Technology / Programming and Systems Analysis / Science (Computer Studies) faculties.
Candidate should have 8+ years of experience in relevant DevOps activities.
Technical:
Good knowledge in Unix platform and database management systems such as SQL, Oracle, Sybase and BigData.
Experience with automation frameworks and libraries.
Proficiency in scripting technologies such as Python, Shell Script and PowerShell.
Good exposure to DevOps tools and technologies like Gitlab, Ansible, Jenkins, Maven, Elastic Search, Grafana, Prometheus, Kibana, Control-M, Kafka, Confluence, Jira, and MQ Series.
Experience in Docker / Kurbernetes.
Knowledge of cloud platforms and services.
Functional:
Experience in supporting capital market applications and trading systems, ideally within the dynamic landscape of Market Risk / Front Office operations with a commendable grasp of financial products e.g., Treasury, FX, Credit, IRD, Bonds, RSF etc.
Nice to Have:
Experience in supporting banking applications and trading systems.
Any object-oriented programming technology: Java, .Net.
Domain-driven design and microservices e.g., Springboot.
Other Professional Skills and Mindset:
Excellent communication and interpersonal skills to effectively collaborate with diverse teams.
Excellent problem-solving and analytical skills.
Ability to work under pressure.
Appetite to follow technology trends and participate to communities.
Eagerness to learn and adapt to new technologies.
Perseverance and diligence towards attaining goals and effective time management.
Passion for sharing expertise and grow team members’ skills.
Autonomous, self-motivated and excellent team player.



Interested candidates can click apply for more information.

** We regret to inform that only shortlisted candidates will be notified. **

We respect your privacy and all communication will be treated with confidentiality. If you wish to know more about this position or explore other roles, please prepare your updated profile and get in touch with our consultants.

Please note that your response to this advertisement and communications with us pursuant to this advertisement will constitute informed consent to the collection, use and/or disclosure of personal data by Manpower for the purpose of carrying out its business, in compliance with the relevant provisions of the Personal Data Protection Act 2012.

Rallonza Bernice Mae Nocum | EA License No. 02C3423 Personnel | Registration No. R1442141"
Devops Engineer,FPT ASIA PACIFIC PTE. LTD.,https://www.mycareersfuture.gov.sg/job/information-technology/devops-engineer-fpt-asia-pacific-dcd9a8bf4fb5401bb8a41143072d7321?source=MCF&event=Search,"Roles & Responsibilities
You will be responsible for designing and operating GitLab, AWS and Kubernetes-based infrastructure and solutions that power our platform, to ensure the stability, scalability, and performance of our runtime platform.

Responsibilities:

Toil Reduction & Automation
Identify repetitive tasks and develop automation via CI/CD pipelines, ensuring integration with cross-functional teams to reduce manual intervention and improve operational efficiency.
Observability & System Health
Implement comprehensive observability solutions (logs, metrics, traces, alerts) around the four Golden Signals (latency, traffic, errors, saturation), and build automation for proactive system health assessments and self-remediation.
Production Support & Incident Management
Participate in on-call rotations, promptly respond to incidents to minimize MTTR, and conduct thorough post-incident reviews to implement preventive measures and improve system resilience.
Security & Compliance
Design and implement solutions that are secure and compliant by collaborating with dedicated security teams, conducting regular audits, and integrating advanced vulnerability scanning tools.
Maintenance, Optimisation & Performance
Identify and resolve performance bottlenecks and operational issues, define and track KPIs (e.g., MTTR, system uptime, cost efficiency), and drive ongoing optimisation efforts.
Strategic Customer Engagement
Act as a technical advisor for tenants, guiding them on containerization, and best practices for cloud-native deployments, and participating in strategic initiatives to enhance platform scalability and performance.
Knowledge Sharing & Documentation
Develop and maintain detailed playbooks, runbooks, and documentation to facilitate team-wide knowledge sharing, streamline incident response, and ensure that critical processes are well understood across the team.
Continuous Learning & Innovation
Stay current with the latest AWS, Kubernetes, and industry developments, and proactively recommend improvements and innovative solutions to maintain a competitive and reliable platform.
Requirements:
Bachelor's degree or Diploma in Computer Science, Engineering, or a related field (or equivalent experience).
Proven experience as a Site Reliability Engineer or similar role, with a strong background in containerization, orchestration, and cloud-native technologies.
Proven ability to troubleshoot and resolve complex technical issues in containerized applications.
Demonstrated experience with incident management, including post-incident reviews and continuous improvement.
Strong documentation skills and experience in knowledge sharing across teams.
Deep understanding of AWS, Kubernetes (including AWS EKS), and operational best practices, with familiarity in multi-cloud or hybrid environments.
Solid grasp of networking, security, and storage in both AWS and Kubernetes contexts.
Experience integrating Kubernetes with AWS cloud technologies (e.g., Secrets Manager, Load Balancers) and using infrastructure-as-code (Terraform or similar).
Hands-on experience with containerization tools (Kubernetes, Kustomize, Helm) and automation scripting (Go, Python, Bash, or equivalent).
Ability to write and maintain automated tests or conduct thorough manual testing for automation scripts, ensuring the reliability and effectiveness of automated solutions.
Familiarity with CI/CD tools (GitLab CI/CD, ArgoCD) and version control systems (Git).
Experience with observability/monitoring tools (Prometheus, Grafana, ELK Stack) and defining SLOs and Error Budgets.
Certifications such as Certified Kubernetes Administrator (CKA) or Certified Kubernetes Application Developer (CKAD) are a plus.
Experience with developing Kubernetes operators using Go, service mesh technologies, and Chaos Engineering is a plus.
Soft skills:
Proactive in identifying problems and recommending strategic solutions.
Excellent problem-solving skills with a robust analytical mindset.
Clear, concise, and effective communication skills; adept at collaborating across cross-functional teams, including development, security, and customer-facing groups.
Ability to remain calm and effective under pressure, especially during incident response.
Adaptability to rapid change with a continuous learning mindset, sharing knowledge to foster team growth.
Customer-focused with the ability to translate technical insights into understandable, actionable guidance.
Leadership and mentoring capabilities, contributing to the development of a resilient and collaborative team environment are a plus."
Devops Engineer (SRE),FPT ASIA PACIFIC PTE. LTD.,https://www.mycareersfuture.gov.sg/job/information-technology/devops-engineer-fpt-asia-pacific-9735225a339b75c573f14b89862fd9ab?source=MCF&event=Search,"Roles & Responsibilities
In this role, you will be responsible for ensuring the security, compliance, and resilience of our infrastructure and applications. You will work closely with cross-functional teams to monitor, respond to, and remediate security incidents across our cloud-native ecosystem.

Responsibilities:

Security Monitoring & Incident Response
Oversee and respond to alerts from AWS GuardDuty, ensuring timely investigation and remediation of incidents.
Execute security playbooks to handle alerts, and enhance them based on evolving threats and operational insights.
Vulnerability & Patch Management
Coordinate the identification and application of security patches across GitLab, AWS, and Kubernetes components.
Ensure that our infrastructure remains resilient to new vulnerabilities through regular patch cycles and proactive risk assessments.
Log Analysis & SIEM Management
Conduct weekly SIEM reviews to analyze security logs, detect anomalies, and escalate issues as necessary.
Collaborate with the SecOps team to refine monitoring strategies and alerting thresholds.
Reporting & Documentation
Prepare monthly SecOps reports summarizing incident trends, response actions, and areas for improvement.
Maintain and update documentation related to security processes, incident response, and playbooks.
Collaboration & Continuous Improvement
Work closely with development, operations, and other security teams to integrate security best practices into CI/CD pipelines and cloud deployments.
Proactively contribute to security strategy discussions, sharing insights and recommendations for enhanced security posture.
Requirements:
Proven experience managing cloud security, particularly within AWS environments (including GuardDuty, IAM, and other AWS security services).
Solid background in securing Kubernetes clusters (preferably on EKS) including experience with container security best practices.
Experience with SIEM tools and log analysis for threat detection.
Proficiency in applying security patches and vulnerability management across cloud and containerized environments.
Familiarity with CI/CD pipelines (GitLab or equivalent) and integrating security into DevOps practices.
Hands-on experience with incident response, including following and refining security playbooks.
Working knowledge of networking, encryption, and other fundamental security concepts.
Security certifications for AWS (such as AWS Certified Security Specialty) and Kubernetes (such as Certified Kubernetes Security Specialist or equivalent) are highly desirable."
"DevOps Engineer, Applied Machine Learning Engine - 2025 Start",BYTEDANCE PTE. LTD.,https://www.mycareersfuture.gov.sg/job/information-technology/devops-engineer-applied-machine-learning-engine-2025-start-bytedance-a9d05d82f366e963d1a64cf15782a092?source=MCF&event=Search,"Roles & Responsibilities
ByteDance will be prioritizing applicants who have a current right to work in Singapore, and do not require ByteDance's sponsorship of a visa.

Founded in 2012, ByteDance's mission is to inspire creativity and enrich life. With a suite of more than a dozen products, including TikTok and Helo as well as platforms specific to the China market, including Toutiao, Douyin, and Xigua, ByteDance has made it easier and more fun for people to connect with, consume, and create content.

Why Join Us
Creation is the core of ByteDance's purpose. Our products are built to help imaginations thrive. This is doubly true of the teams that make our innovations possible.
Together, we inspire creativity and enrich life - a mission we aim towards achieving every day.
To us, every challenge, no matter how ambiguous, is an opportunity; to learn, to innovate, and to grow as one team. Status quo? Never. Courage? Always.
At ByteDance, we create together and grow together. That's how we drive impact - for ourselves, our company, and the users we serve.
Join us.

About the Team
The Applied Machine Learning (AML) team combines system engineering and the art of machine learning to develop and run massively distributed recommendation system around the world.

On the team, you'll have the opportunity to sharpen your expertise in coding, performance analysis and large system operation, and get heavily involved in the process of hardware/capacity decision-making.

DevOps ensures that the very centric machine learning services at TikTok have the highest level of availability, as well as creating highly automated systems and pipelines.

We are looking for talented individuals to join us in 2025. As a graduate, you will get unparalleled opportunities for you to kickstart your career, pursue bold ideas and explore limitless growth opportunities. Co-create a future driven by your inspiration with ByteDance.

Candidates can apply to a maximum of two positions and will be considered for jobs in the order you apply. The application limit is applicable to ByteDance and its affiliates' jobs globally. Applications will be reviewed on a rolling basis - we encourage you to apply early.

Responsibilities
- Research, design, and develop computer and network software or specialised utility programs.
- Analyse user needs and develop software solutions, applying principles and techniques of computer science, engineering, and mathematical analysis.
- Update software, enhances existing software capabilities, and develops and direct software testing and validation procedures.
- Work with computer hardware engineers to integrate hardware and software systems and develop specifications and performance requirements.
- Research, design, and develop computer and network software or specialised utility programs.
- Analyse user needs and develop software solutions, applying principles and techniques of computer science, engineering, and mathematical analysis.
- Update software, enhances existing software capabilities, and develops and direct software testing and validation procedures.
- Work with computer hardware engineers to integrate hardware and software systems and develop specifications and performance requirements.
Qualifications
Minimum Qualifications
- Final year or recent graduate with a background in Software Development, Computer Science, Computer Engineering, or a related technical discipline
- Experience programming in at least one of the following languages: Python or C/C++
- Expertise in DevOps technologies like Ansible, Terraform, Salt, Bash Scripting, etc.
- Experience in building solutions with AWS, Google, Azures, AliCloud or other cloud services.
- Familiar with Unix/Linux operating systems.

Preferred Qualifications
- Ability to thrive in a fast-paced environment.
- Strong understanding of code optimizing and routine tasks automation.
- Proficiency in at least one machine learning framework: TensorFlow, PyTorch, MXNet or PaddlePaddle.
- Solid background of algorithms and data structures.

ByteDance is committed to creating an inclusive space where employees are valued for their skills, experiences, and unique perspectives. Our platform connects people from across the globe and so does our workplace. At ByteDance, our mission is to inspire creativity and enrich life. To achieve that goal, we are committed to celebrating our diverse voices and to creating an environment that reflects the many communities we reach. We are passionate about this and hope you are too.

By submitting an application for this role, you accept and agree to our global applicant privacy policy, which may be accessed here: https://jobs.bytedance.com/en/legal/privacy.

If you have any questions, please reach out to us at apac-earlycareers@bytedance.com"
